timestamp,user_id,from,content,to
2001-02-06 02:30:46,brittneycunningham,glen64@example.org,Degree draw special.,davismatthew@example.com
2001-02-15 05:26:15,wilsontimothy,fthomas@example.net,Plant interview voice catch goal push worry.,vreynolds@example.org
2001-02-13 14:19:14,gilberthannah,allenmargaret@example.com,Concern decade per could wind heavy.,thompsoncheryl@example.net
2001-02-07 23:23:47,ithompson,cmichael@example.org,Soon necessary oil former even.,jrodriguez@example.com
2001-02-07 00:17:28,heather35,dhurst@example.net,Walk sea participant stop.,abond@example.com
2001-02-19 07:31:48,dianewood,tclark@example.net,This sometimes table nation side adult student.,michaelwashington@example.net
2001-02-06 09:16:06,gouldjennifer,brandy59@example.net,Whether floor investment involve.,ahensley@example.com
2001-02-12 07:32:30,jasonharris,angela71@example.net,Enter per top lay grow on.,sharon74@example.net
2001-02-13 23:55:50,cscott,william48@example.net,Mention live loss town force lead every.,brian79@example.net
2001-02-09 23:51:05,christian70,devin73@example.net,Your hot follow.,hgonzalez@example.org
2001-02-18 00:15:48,robertsmith,scottsellers@example.com,Air less between his network.,jacksonmichelle@example.com
2001-02-17 21:13:34,sandersandrew,randall16@example.net,Ask floor whether property medical.,tristanwilliams@example.org
2001-02-08 17:34:28,idavis,christianspencer@example.net,Music give next mention begin official mother realize.,wilsonvalerie@example.com
2001-02-09 07:27:15,martinezmichael,davidpineda@example.net,Early as condition evidence our us why.,sullivandavid@example.net
2001-02-15 08:27:28,ptodd,stewartmichael@example.com,Order check before single.,jacobwhite@example.com
2001-02-05 18:51:29,alejandra55,shawn09@example.net,Choose learn notice hospital image bed.,ahensley@example.com
2001-02-05 03:44:07,kirkdouglas,khall@example.net,Heavy open goal pick throughout.,munozrebecca@example.org
2001-02-13 13:08:12,jacquelinebennett,laura62@example.net,Behind year stay floor pull well.,jennifer81@example.org
2001-02-06 10:17:55,paul29,marshalljillian@example.net,Sometimes then can quickly.,lisa52@example.com
2001-02-12 16:33:00,jennifer25,jacksonmichelle@example.com,Kitchen morning door base story from.,vincent46@example.com
2001-02-13 00:48:37,regina72,fsmith@example.org,Smile fast more practice for.,herbert85@example.org
2001-02-12 23:29:43,wolfecarolyn,hilljulia@example.org,Morning among movement indicate space.,juan60@example.net
2001-02-10 15:11:50,jonathanbarton,donnadelacruz@example.org,Much city middle responsibility while.,johnsonwilliam@example.net
2001-02-18 07:12:40,williamscurtis,malloryhines@example.com,Various fish through after young.,harryromero@example.com
2001-02-07 13:32:02,moniqueporter,choierin@example.net,Success scene place somebody animal.,joseph24@example.net
2001-02-15 04:34:23,andersonjames,jacob53@example.com,Candidate no brother project address best.,thomasarroyo@example.com
2001-02-17 19:54:29,fdennis,joseph98@example.net,When deal summer treat hair pull seat.,candacekim@example.com
2001-02-17 03:36:12,robert55,samantha46@example.com,Particularly writer people play.,joshua06@example.net
2001-02-18 02:33:28,rebeccawright,warrencarol@example.org,Loss dinner serious statement people.,chenkatie@example.org
2001-02-15 12:24:19,patriciaharris,jasmin20@example.org,Safe only I and hot none mean.,davismatthew@example.com
2001-02-14 18:46:02,wallerjoseph,christopherdecker@example.net,Light task summer listen tend service sign bank.,smithangela@example.net
2001-02-06 07:20:35,smerritt,justin51@example.net,Price hotel wear or.,ssmith@example.net
2001-02-12 10:42:14,sandrawilliams,ashleymorales@example.net,Study station hit particularly difficult actually Republican.,peter18@example.net
2001-02-19 09:28:03,kellykemp,schneidernicholas@example.com,Teacher public learn social maintain lot.,sbell@example.org
2001-02-14 09:57:08,josephmiller,zirwin@example.net,Floor me prevent simply charge stage professor stand.,lunamark@example.net
2001-02-11 17:47:25,nwilliams,manningsamuel@example.com,Sit source challenge face social car model.,hkennedy@example.net
2001-02-07 15:26:41,aball,katelyndavis@example.net,Know serve among.,melissa11@example.com
2001-02-13 01:03:19,harrisjoe,jeffrey15@example.net,Home recognize process central movie memory agent beyond.,joshuagonzalez@example.org
2001-02-18 18:30:50,dphillips,charlesramirez@example.net,Source job likely college realize authority be.,christianspencer@example.net
2001-02-11 01:28:44,janet40,mclaughlinshannon@example.net,Enjoy yeah receive indicate stock parent.,dstein@example.net
2001-02-10 10:46:47,charlesgreen,huffgeorge@example.org,Smile task cut design house respond.,millerrhonda@example.com
2001-02-06 01:01:54,freemanjames,brianbrady@example.org,Before boy box hold them.,fsnow@example.com
2001-02-06 23:10:36,jerry73,chapmanbilly@example.net,Line situation red lot.,vanessalawrence@example.com
2001-02-16 05:56:15,cbishop,bradley35@example.net,Guess probably technology.,youngmatthew@example.net
2001-02-14 22:23:04,dianeherring,alexanderlopez@example.com,Road politics north once item challenge.,vanessalawrence@example.com
2001-02-06 01:01:54,edwin25,hermandeborah@example.com,Bad little impact other.,lewissherry@example.org
2001-02-13 10:09:55,eanderson,rrogers@example.net,Operation she increase owner myself market.,manndaniel@example.org
2001-02-10 23:17:25,kylebrewer,carolgonzalez@example.com,Fire may north.,isabellasimmons@example.org
2001-02-14 00:28:12,powellkaren,beckerdylan@example.org,Daughter relationship sport range possible author.,alex61@example.net
2001-02-18 06:55:16,cheryljackson,patrick02@example.com,Daughter career physical.,greenjerry@example.com
2001-02-14 02:58:27,haroldrivera,sandra89@example.net,Whatever south step to possible hit it.,sanchezshelly@example.com
2001-02-06 13:04:25,jonescharles,wkim@example.com,Everything view green turn me trade cup.,roberttucker@example.org
2001-02-07 13:53:44,mooreanna,camachoashley@example.org,Sell war pick.,jacobwhite@example.com
2001-02-18 16:26:13,rebecca01,scott59@example.org,Five almost far myself.,anna68@example.org
2001-02-05 18:39:56,aprilwood,lgarcia@example.org,Hundred soon usually summer.,coopersuzanne@example.com
2001-02-12 12:00:21,josephmartinez,tuckermelanie@example.com,Project their perform support.,curtis03@example.net
2001-02-07 05:35:53,josephmartinez,tuckermelanie@example.com,Sport social hand early.,campbellbenjamin@example.com
2001-02-09 01:02:08,stevenhardin,joshuaarnold@example.com,Ago project option.,linda67@example.com
2001-02-13 18:07:10,nashlucas,nlin@example.net,Could while nothing ability police million dream.,phillipsjoshua@example.com
2001-02-05 03:44:07,pricekaylee,amyjimenez@example.com,Everything fire impact outside.,william70@example.org
2001-02-10 14:02:52,elizabeth58,lunamark@example.net,Indicate require thank bed eye all.,angela71@example.net
2001-02-16 00:37:22,beverly61,jonescarla@example.com,Five drop scene note effect reveal forward quickly.,kathryn57@example.com
2001-02-15 06:03:54,athomas,tramos@example.net,Each watch reason community factor entire.,john01@example.net
2001-02-18 19:24:27,kellykyle,debrawilliams@example.com,Goal fight arm stay a close.,jcrawford@example.org
2001-02-13 01:58:50,edward59,bjohnson@example.net,Student any brother yet reach.,oford@example.org
2001-02-08 18:23:37,michealsmith,david11@example.net,Job under two generation task.,levipowell@example.org
2001-02-16 03:35:16,erinbaker,katherinenavarro@example.net,Sound live campaign.,kylebrown@example.net
2001-02-10 06:55:30,carlmartin,michaelthomas@example.net,Indicate citizen rather.,danielsoto@example.org
2001-02-11 21:03:46,davidmiller,ssmith@example.net,Writer approach military move issue.,becky77@example.net
2001-02-08 08:43:43,patrickrivera,mbrock@example.org,Financial moment writer half.,jessicabrennan@example.net
2001-02-09 15:23:07,clarencechavez,stevenmartinez@example.org,Away agency business scientist poor amount audience build.,bondmichael@example.com
2001-02-08 19:46:55,mikewarren,pcarney@example.net,Education many over color role still water.,stephengonzalez@example.com
2001-02-09 05:21:07,wilsonalicia,lclark@example.com,Move suggest feel officer court.,mark42@example.com
2001-02-06 18:17:12,robinsoncraig,mary40@example.com,Begin common total language lay.,zunigajennifer@example.net
2001-02-14 12:29:37,philipwilliams,martinezkevin@example.net,Interview seek various collection player why.,levipowell@example.org
2001-02-07 01:40:38,danielle53,cynthia40@example.net,Would force skin take pull from set section.,alexanderedwards@example.org
2001-02-17 03:44:50,mmarshall,kathy35@example.com,Born standard position position you top sometimes.,hallrobin@example.org
2001-02-07 12:11:15,haleyhoward,brittanyford@example.com,Suffer health feeling case.,atkinsonveronica@example.org
2001-02-12 07:29:55,sandersandrew,randall16@example.net,Majority force seek create.,kevin94@example.com
2001-02-16 12:27:54,linda38,tonyameyer@example.net,Know situation company point mouth phone.,fclark@example.net
2001-02-05 23:31:11,mikewarren,pcarney@example.net,Find issue cause although recognize.,kingjennifer@example.net
2001-02-09 12:47:01,daylinda,cookjennifer@example.net,President four right hot must especially development.,jessicasanchez@example.org
2001-02-19 10:51:15,valeriesingleton,garciajames@example.com,Police eat former throughout radio wall.,mendezjames@example.org
2001-02-12 02:57:39,fdennis,joseph98@example.net,Goal design seek establish young space option.,jwilson@example.com
2001-02-05 23:48:21,kaneryan,nicolephillips@example.net,Finish somebody role notice significant design.,ericcooper@example.net
2001-02-10 19:17:32,batesalexander,juliawells@example.com,Audience key investment civil month.,lsmith@example.org
2001-02-14 14:32:00,phowell,gloriawest@example.net,All good determine front data.,nathanmcclain@example.net
2001-02-13 21:40:17,gonzalezjames,wgonzales@example.com,Crime food population may.,wilkersonjacqueline@example.com
2001-02-16 22:30:44,catherine04,keithlee@example.net,Low home policy police site soon position.,joshuacooper@example.net
2001-02-12 16:25:17,angela41,cheryl31@example.net,Produce collection property old.,atkinsonveronica@example.org
2001-02-18 23:00:46,woodcharles,vgutierrez@example.net,Evidence care his matter few necessary order.,sarahmcmahon@example.com
2001-02-12 01:29:58,jasonponce,rebecca14@example.net,Spring first finally response.,bjoseph@example.net
2001-02-07 02:02:54,bryanguerrero,cindy06@example.org,Authority top cell shoulder.,jenkinsjocelyn@example.org
2001-02-11 09:08:55,cbishop,bradley35@example.net,Bar Mrs them medical direction.,mary40@example.com
2001-02-08 18:58:52,eileenarnold,mooreelizabeth@example.com,Case treatment see station phone weight consider.,haley38@example.org
2001-02-18 01:04:30,riveravanessa,matthew30@example.com,Understand these easy become school everybody.,clarkerin@example.com
2001-02-17 11:13:08,iellis,dmiller@example.net,Face movement lose behind home.,brenda58@example.org
2001-02-07 00:46:37,leelindsay,vmooney@example.com,About culture ready where contain similar human black.,cdixon@example.net
2001-02-10 14:02:52,jaclyn43,tcalhoun@example.com,Rate these enjoy different feel military outside.,mbrock@example.org
2001-02-14 12:38:05,christinewallace,susanmartin@example.org,Adult somebody charge view.,xmassey@example.com
2001-02-13 12:10:49,jonathan03,stephaniebryant@example.org,Candidate glass last ahead ago person free.,joshuagonzalez@example.org
2001-02-09 09:58:20,moniqueporter,choierin@example.net,May minute soon discuss cup success.,leroygomez@example.net
2001-02-08 17:00:09,lsullivan,jcampbell@example.com,Design identify debate magazine.,dcraig@example.net
2001-02-10 16:04:20,amy09,rcook@example.org,Finish professor far break professional very player.,sharpcynthia@example.com
2001-02-05 02:44:02,jennifer68,yhill@example.com,Large population help drug send usually.,kathryn36@example.com
2001-02-13 00:36:50,phart,anthonybooker@example.com,Tend since according woman resource security room.,pfreeman@example.net
2001-02-17 23:30:37,amy36,zacharyclark@example.com,Notice figure opportunity reveal.,martinezkenneth@example.net
2001-02-06 01:22:34,lauracook,sharon52@example.org,Loss at minute citizen social.,danielsoto@example.org
2001-02-17 22:58:35,rkim,clarkxavier@example.org,Throughout identify mean talk western.,clarkkristi@example.net
2001-02-10 22:07:09,georgewebster,tinashaffer@example.net,See institution shoulder cause or security go.,joshuaarnold@example.com
2001-02-15 20:37:42,howardjonathan,brian80@example.org,Daughter win imagine sit build.,erikaoconnor@example.org
2001-02-15 21:07:19,sheila13,vegadawn@example.com,Just near collection grow theory.,keithlee@example.net
2001-02-08 10:20:57,athomas,tramos@example.net,Last change building but many.,nelsonnichole@example.com
2001-02-13 23:28:23,donnapowers,poolekyle@example.net,Employee perform still floor collection.,mary30@example.com
2001-02-06 17:38:08,brooke15,danaglover@example.org,Attorney practice pass hospital home detail.,theresachavez@example.com
2001-02-11 03:58:15,yacevedo,erichorton@example.net,Room develop certain quality data.,sherri29@example.com
2001-02-17 12:07:54,oliverchristian,yharris@example.net,Order glass however rock share.,manndaniel@example.org
2001-02-11 06:54:10,chavezjasmine,sarahmcmahon@example.com,Heavy seem child compare list never activity address.,melissa13@example.com
2001-02-13 20:53:04,mcneilsusan,john06@example.com,Yes design hundred face focus there character.,brett61@example.net
2001-02-18 22:16:24,jonathan24,xmassey@example.com,Describe pass rule west need.,aimee36@example.com
2001-02-11 13:42:17,sandersandrew,randall16@example.net,Perform dog evening answer rest pull.,chelseachase@example.net
2001-02-18 05:42:10,leetracy,christian76@example.org,Rather first story.,biancadaniels@example.net
2001-02-15 04:13:54,lisa56,ashleywilliams@example.net,Weight add product cultural practice machine reflect.,david11@example.net
2001-02-11 07:26:32,christopher48,levipowell@example.org,Whose young rate.,peter18@example.net
2001-02-17 10:37:34,natasha45,griffinjessica@example.org,Occur between back card pattern score.,santiagosummer@example.com
2001-02-18 03:54:29,lduncan,robertsralph@example.net,Really pay new return country ago.,crystalthomas@example.com
2001-02-10 06:34:23,patrick05,shelly67@example.org,Ago figure his quite share view ten.,lisajohnson@example.org
2001-02-15 08:54:17,emily84,juliawilliams@example.com,Actually item truth until.,louis74@example.org
2001-02-06 16:19:10,edwincooke,mgonzalez@example.org,Try peace try say.,catherinejohnson@example.net
2001-02-17 08:09:07,crystal52,nicolas47@example.org,Month true rule beyond shake this carry most.,martinezkevin@example.net
2001-02-15 08:33:11,fcox,juan98@example.com,Cold want easy kind surface story camera.,lauren34@example.net
2001-02-17 14:29:01,xprice,nbryan@example.com,Community likely development key million hotel write east.,rhodesjoshua@example.net
2001-02-09 07:07:06,mlee,ryanshannon@example.com,Article military degree region relate.,keith28@example.net
2001-02-16 10:59:10,latoya13,wallacelaura@example.org,Keep challenge sometimes student.,ssmith@example.net
2001-02-07 15:47:33,joseph08,krichardson@example.com,Coach painting such.,vincent46@example.com
2001-02-17 06:39:45,reyestracy,anthonyedwards@example.org,Public consider own test threat candidate.,rodriguezlarry@example.com
2001-02-08 16:11:56,linda75,bhansen@example.org,Do role discuss baby would hot.,kerrchristy@example.net
2001-02-16 15:23:56,idavis,christianspencer@example.net,Policy poor compare hold wrong him remember.,abond@example.com
2001-02-18 11:23:12,sjones,fsnow@example.com,Pretty particularly boy feeling.,logan52@example.com
2001-02-09 03:52:25,obriengeorge,mark42@example.com,Hundred sound successful.,john06@example.com
2001-02-17 12:44:08,judy80,santanadaniel@example.com,Plan character west single property big.,thompsoncheryl@example.net
2001-02-16 22:12:26,ssanders,williamhamilton@example.org,Before try ball imagine.,wkelley@example.net
2001-02-13 16:43:57,daylinda,cookjennifer@example.net,Wind news however nor stock explain collection provide.,jessica68@example.com
2001-02-07 07:00:13,pharris,christina80@example.com,Task its parent follow hard human long production.,rrogers@example.net
2001-02-15 06:15:53,bellkathleen,millerjoshua@example.org,Name radio source speech.,brian83@example.org
2001-02-18 01:17:33,perkinschristopher,hbrown@example.com,Within player peace member near choice ready drive.,vgomez@example.net
2001-02-12 19:36:51,matthew61,melanieklein@example.com,Again pay than issue turn.,whiteangela@example.net
2001-02-12 23:23:46,gwilliamson,moorejames@example.com,Data enjoy plan green clearly.,raymondjones@example.com
2001-02-15 15:25:42,garnerkathleen,lwang@example.com,Force service contain leader president least.,phyllisescobar@example.com
2001-02-10 13:07:42,judy80,santanadaniel@example.com,Truth five join world difficult owner community.,thompsoncheryl@example.net
2001-02-18 08:29:09,heathdwayne,claytoncalvin@example.com,Man Democrat thus member better team.,jonathanfowler@example.org
2001-02-19 10:21:50,baxtermonique,melissa86@example.net,Field effect show fire can.,josephmartin@example.com
2001-02-08 04:11:35,kevin11,cheryl76@example.org,Technology visit indicate stage investment wall.,nelsonnichole@example.com
2001-02-13 01:39:41,susancook,yblackwell@example.org,Be nation near sound sell another.,jeffrey15@example.net
2001-02-12 19:12:46,simmonssean,saunderslaura@example.com,Value rate affect bank cultural if.,lopezbrittney@example.net
2001-02-11 22:42:43,matthew52,felicia45@example.com,Speech firm public research another international travel.,mpatterson@example.net
2001-02-07 21:15:10,kstephens,sabrinacannon@example.org,Animal such security.,qblankenship@example.com
2001-02-19 01:55:00,leeryan,susan43@example.org,Heavy wait build.,kaitlyn32@example.net
2001-02-17 19:54:29,loganbrooke,melissaharper@example.net,Note every allow wall stuff budget.,randall16@example.net
2001-02-07 20:34:58,jorgemorgan,bobbytaylor@example.org,Course hotel bag.,martinezkenneth@example.net
2001-02-08 13:59:01,natalie54,jamesmartinez@example.org,Face forward discussion.,fthomas@example.net
2001-02-07 08:13:46,mackenzie46,williamstammy@example.org,Short assume far hold major teach serve technology.,brittneycunningham@example.net
2001-02-12 13:21:23,johnsonstephanie,valeriejohns@example.net,Which so table record become fly.,davisjames@example.com
2001-02-06 20:24:44,carrollpeter,robertlee@example.org,Recognize thought trial force yard group run.,cynthia40@example.net
2001-02-05 06:55:14,vferguson,jennifer56@example.com,Mean answer decade bank including truth water.,vmooney@example.com
2001-02-17 15:26:28,jonathan71,xmoreno@example.org,To born Congress upon range nearly during listen.,jasmin20@example.org
2001-02-14 06:31:41,robertknight,nibarra@example.com,Smile half each so thought military show.,hughessarah@example.net
2001-02-06 03:32:15,jeffjenkins,brett61@example.net,Decide account out wish trade.,pmclean@example.org
2001-02-17 18:54:31,rebecca21,amandagarrison@example.com,Small turn set choice social.,sabrinacannon@example.org
2001-02-14 11:40:46,kevin21,pattersonrobert@example.net,Including either treatment culture Mrs.,qmorris@example.org
2001-02-05 21:06:16,sjones,fsnow@example.com,Five sell likely their.,millerjoshua@example.org
2001-02-05 09:14:42,jonkrause,villanuevapatrick@example.net,Practice these central billion environmental house.,kimberlymccarthy@example.net
2001-02-14 17:26:42,debrablack,michaelwashington@example.net,Him draw form skill pattern it.,stoutjoe@example.net
2001-02-10 21:24:50,shawrobin,peter95@example.net,Old travel several politics here.,bradley35@example.net
2001-02-13 15:03:33,bradlewis,danielsoto@example.org,Line build even nature then very daughter.,gwelch@example.net
2001-02-07 00:45:13,dayeric,tjohnson@example.com,Technology under space enjoy idea reveal civil.,oholmes@example.org
2001-02-07 03:34:31,madelineedwards,iparrish@example.com,Experience cold myself soldier technology sister.,susan43@example.org
2001-02-18 03:00:55,patricktanner,vgomez@example.net,Government stand art follow view.,rosechan@example.org
2001-02-15 12:04:59,blairjessica,campbellbenjamin@example.com,I team he describe chair half.,lsmith@example.org
2001-02-09 08:36:36,brockkelly,jefferychristian@example.com,Positive yard green source trouble soldier major.,kevin03@example.org
2001-02-13 05:41:59,staylor,michaelmitchell@example.org,Professional individual certain school in political.,pmclean@example.org
2001-02-11 18:11:43,edwin25,hermandeborah@example.com,Choose coach success dark.,zunderwood@example.net
2001-02-15 15:25:42,traceysmith,ghamilton@example.org,Model mother population federal.,lgarcia@example.org
2001-02-18 02:10:12,mccormickshannon,fowlerlauren@example.org,City husband question tree.,vanessa60@example.net
2001-02-07 07:16:33,natalie54,jamesmartinez@example.org,Trial happy interesting that.,katelyndavis@example.net
2001-02-07 01:01:23,ashley33,brownnicole@example.org,Alone central theory.,nmckenzie@example.com
2001-02-08 20:05:25,colleendixon,abond@example.com,Almost ahead school within science.,anitagonzalez@example.com
2001-02-05 07:02:46,bennettkimberly,alexanderedwards@example.org,Somebody American first heart.,fitzgeraldallison@example.com
2001-02-17 13:57:29,veronica68,kelsey12@example.net,Reality walk pressure else girl administration catch.,saunderslaura@example.com
2001-02-18 01:03:19,katherine68,manndaniel@example.org,Idea course decide tree yes table expect.,romerolaura@example.net
2001-02-09 20:10:39,linda65,randalldavis@example.org,Project garden success cut store raise develop.,martinezkevin@example.net
2001-02-19 03:52:45,kimberly84,ashley49@example.net,Quite must air force economy amount.,bhansen@example.org
2001-02-12 06:20:06,youngwayne,christophersoto@example.net,Everything like industry friend among.,schoi@example.com
2001-02-10 09:29:45,leslie68,tammiepeterson@example.com,Also find share perform.,cunninghamrichard@example.org
2001-02-08 07:10:08,xsaunders,kylie13@example.com,Effect three anything water stand society.,qhicks@example.net
2001-02-06 16:11:58,bellkathleen,millerjoshua@example.org,Along might pattern vote authority safe goal.,zwillis@example.org
2001-02-09 04:18:28,osalazar,williamsjennifer@example.com,Agency describe seem show.,iyoung@example.org
2001-02-06 07:57:54,lsullivan,jcampbell@example.com,Evening world blue impact.,garciacarolyn@example.net
2001-02-17 20:19:41,emily84,juliawilliams@example.com,Inside business dream apply production.,sarazimmerman@example.net
2001-02-05 14:03:49,xprice,nbryan@example.com,Officer production floor college wait simple.,cindy40@example.org
2001-02-09 11:59:33,wnicholson,biancadaniels@example.net,Coach development exactly office society huge begin.,michael62@example.com
2001-02-08 12:17:13,peterherrera,kennethmullins@example.com,Night each reality usually watch since such.,nathanmcclain@example.net
2001-02-16 23:05:14,batesalexander,juliawells@example.com,Source apply generation remain.,lisa75@example.net
2001-02-14 09:34:53,brittanymcbride,aduffy@example.com,Hit most maintain six join push center.,tamara89@example.com
2001-02-06 08:43:11,evanhenson,victoria39@example.org,Mr unit community away.,jacksonlindsay@example.org
2001-02-07 13:42:29,millerdavid,kelseyjoseph@example.com,Old hour recent down.,hhood@example.net
2001-02-09 04:49:08,jillgoodwin,shanna@example.net,Bit leader already.,jasonjackson@example.org
2001-02-13 06:34:08,jonathantodd,clandry@example.com,Health question hospital plan.,mendezjames@example.org
2001-02-11 06:19:54,christopher96,kaylacase@example.org,What fire compare charge standard mouth this.,ericawood@example.net
2001-02-17 21:25:05,arthur20,smoore@example.net,Each return son party.,riveranichole@example.org
2001-02-06 15:10:26,opatterson,caitlingreen@example.com,Land range school several environmental military cover central.,joshuagonzalez@example.org
2001-02-11 01:54:26,xgutierrez,qblankenship@example.com,Land research international same whole.,weeksrichard@example.org
2001-02-17 16:55:57,philipwilliams,martinezkevin@example.net,Likely avoid situation land movie difference.,barry13@example.net
2001-02-15 07:23:59,vcunningham,gperry@example.net,Rather our pay stay evening feeling protect.,crystalthomas@example.com
2001-02-08 19:17:23,schmidtkevin,hallmarcus@example.org,Than suggest course check born knowledge approach rather.,justin51@example.net
2001-02-08 10:14:57,johnny41,lauramendez@example.com,Raise film sport.,pfoley@example.org
2001-02-10 19:54:30,bellkathleen,millerjoshua@example.org,Wide which base side down account ahead.,jorgethomas@example.org
2001-02-12 04:11:19,powellkaren,beckerdylan@example.org,Matter man only former dog senior.,vmooney@example.com
2001-02-09 04:17:21,carlmartin,michaelthomas@example.net,Law there especially culture.,brittanyford@example.com
2001-02-15 13:58:45,jennifer55,josejones@example.org,Research military raise should employee husband.,uwells@example.com
2001-02-16 23:14:56,xayala,patricknelson@example.com,Onto part member.,scottmedina@example.com
2001-02-08 16:37:53,christinewallace,susanmartin@example.org,Mr company laugh remain modern.,jonesrichard@example.org
2001-02-17 20:34:51,briggsmichael,lauraferguson@example.net,Public attack finish sell recognize Mrs.,smallrichard@example.com
2001-02-13 00:12:26,jeffrey85,youngmatthew@example.net,Would reduce number benefit consumer.,yoderfaith@example.com
2001-02-05 14:36:00,stevensjohn,hannahmelton@example.net,Scientist draw either.,vegadawn@example.com
2001-02-19 09:28:03,sheppardmichaela,dbarr@example.org,Town point exist outside century.,gturner@example.org
