timestamp,user_id,from,content,to
2001-02-06 08:01:29,fayers,kylie37@example.com,Ball do member be ability sea ball physical.,bjohnson@example.net
2001-02-12 23:29:41,smithkellie,brian83@example.org,Someone purpose skin knowledge window.,qgomez@example.org
2001-02-14 01:47:43,pattersonjames,stephanie52@example.com,Ok soon politics over outside cup support.,jeffmoore@example.org
2001-02-13 22:20:12,katherine37,heather25@example.org,East have fly.,stoutjoe@example.net
2001-02-14 17:47:37,jordansusan,amycampbell@example.com,Money defense nearly environmental finish sure cell.,dromero@example.org
2001-02-18 10:56:12,zsmith,michellejenkins@example.net,Fire claim them near dream.,christian76@example.org
2001-02-09 20:36:41,traviscooley,wendynewman@example.org,Thus final common everyone once.,sharpcynthia@example.com
2001-02-09 10:38:45,william65,brandon15@example.com,Bit bar civil.,smithangela@example.net
2001-02-09 00:44:07,skennedy,tiffanyrosales@example.net,Day level probably.,xbrown@example.com
2001-02-10 22:07:09,carrollpeggy,ryan51@example.org,Air remain reveal.,melissa11@example.com
2001-02-19 01:32:10,joseph08,krichardson@example.com,Within firm create what shake paper.,keith28@example.net
2001-02-10 17:50:40,margaretwalker,natashaparsons@example.com,Boy act share fly door Congress serious.,waltondaniel@example.com
2001-02-07 10:46:45,jennifer80,ahensley@example.com,Argue quickly state dinner to responsibility.,jcampbell@example.com
2001-02-09 19:30:48,courtneysanchez,brittneycunningham@example.net,Thousand card music central play.,annjohnson@example.org
2001-02-08 17:36:15,amy36,zacharyclark@example.com,Mrs she prove miss.,markellis@example.org
2001-02-17 09:30:21,scottspencer,dguzman@example.com,Population clear center international together.,ronniebauer@example.net
2001-02-05 15:16:20,tammyfranklin,nguyensabrina@example.net,Cut professional political hold modern.,reidjoseph@example.com
2001-02-16 04:33:41,bartonjason,lopezbrittney@example.net,Sit six realize film note president any.,daniel85@example.org
2001-02-10 22:35:59,stewartanthony,ycole@example.net,Box table behind.,vanessalawrence@example.com
2001-02-09 13:41:31,kwilliams,bowenjamie@example.org,Phone manager south another choose bank back.,sandovalmatthew@example.net
2001-02-07 17:25:07,christopher53,richardsjesus@example.com,Magazine speak current member wrong knowledge.,patrick02@example.com
2001-02-06 13:41:36,youngwayne,christophersoto@example.net,Concern others outside issue herself anything.,tclark@example.net
2001-02-10 05:18:26,david08,aimee36@example.com,Various thought nice.,carterrobert@example.com
2001-02-15 19:34:08,cthomas,collincombs@example.org,Civil current where foot nothing draw even.,ronaldford@example.org
2001-02-13 15:55:47,nashlucas,nlin@example.net,Style believe people before.,drichardson@example.net
2001-02-13 14:52:45,daviskathy,linda37@example.net,Audience southern school my decade admit.,melissa11@example.com
2001-02-12 12:22:32,karenschwartz,josephchristopher@example.org,Well thus reflect four.,tbrown@example.org
2001-02-11 21:52:36,jallen,waltondaniel@example.com,Others however maintain region their tough.,daniel89@example.net
2001-02-13 19:10:12,mooreanna,camachoashley@example.org,Should raise learn authority word.,perezjohn@example.org
2001-02-05 13:25:30,groberts,joann65@example.org,Spring blood into analysis bill adult.,pfleming@example.org
2001-02-17 05:38:40,lisahughes,theodorerice@example.org,Official president low occur during bar property.,tristan30@example.org
2001-02-19 13:07:22,evanhenson,victoria39@example.org,Tv unit bit.,qflowers@example.com
2001-02-16 06:20:03,cheryljackson,patrick02@example.com,Its college hot cover seek should tax according.,lauraferguson@example.net
2001-02-11 20:17:40,beckerlisa,matthewscristina@example.org,Religious peace step paper staff tax his.,juliawilliams@example.com
2001-02-06 16:18:02,jonathan18,stevenvalencia@example.com,With leg sell degree.,jfriedman@example.org
2001-02-13 16:13:47,nsalinas,melissawong@example.net,Little conference money cost.,fergusonpam@example.org
2001-02-11 05:43:40,ubradley,peter18@example.net,Republican bank Congress race.,mark42@example.com
2001-02-15 04:03:44,valeriesingleton,garciajames@example.com,Example treatment order mind above member direction list.,zimmermanaudrey@example.net
2001-02-07 22:27:15,tommy96,haley38@example.org,Good among how save two believe.,nicoledecker@example.net
2001-02-16 16:09:30,debrablack,michaelwashington@example.net,Eye high effect.,cruzdeanna@example.org
2001-02-06 02:00:00,victordavis,robert10@example.org,Foreign property cut life candidate sometimes stand.,kendra56@example.net
2001-02-05 10:14:19,donnanguyen,qwaller@example.com,Stock draw policy from whole style board.,robertcrosby@example.net
2001-02-08 07:18:32,linda75,bhansen@example.org,Share continue however it go improve individual.,cholland@example.net
2001-02-16 09:57:09,nataliewright,atkinsondavid@example.net,Attention grow pass study of still century.,bradley80@example.com
2001-02-16 08:18:56,courtneysanchez,brittneycunningham@example.net,Agree tend people become since.,daniel89@example.net
2001-02-05 03:44:07,yshort,eugene48@example.net,Response kitchen deal huge.,nthompson@example.org
2001-02-19 04:06:10,brian88,annchristensen@example.org,Model everyone old above relate play arrive training.,kennethmiller@example.net
2001-02-11 18:52:33,vanessacrawford,davisjames@example.com,Will music factor least show.,joshuaarnold@example.com
2001-02-07 18:51:23,kayla53,bradley11@example.com,Six drug peace standard vote watch picture.,villanuevapatrick@example.net
2001-02-15 16:08:28,jeffrey85,youngmatthew@example.net,Open film quality news attorney piece former.,kelseyjoseph@example.com
2001-02-15 19:54:21,rachelmarshall,pperkins@example.com,Impact enter back article act affect key.,michael22@example.net
2001-02-13 20:58:05,samantha04,madelineandrews@example.net,Factor purpose them leader could case bit.,smithangela@example.net
2001-02-17 17:50:49,rogersdakota,frankamy@example.org,How explain PM front.,josearnold@example.com
2001-02-08 05:01:10,joshuavasquez,nicole16@example.com,Probably attorney might affect their carry perform.,william70@example.org
2001-02-15 13:52:00,michaelcarpenter,iklein@example.com,Easy understand at issue perhaps.,bonnieholland@example.org
2001-02-16 23:15:36,iperkins,rbowen@example.com,Reason scientist late month green.,jacob53@example.com
2001-02-17 05:26:07,tiffany02,athompson@example.com,Change half maintain bar.,webbjacob@example.com
2001-02-06 01:56:04,ehunt,morrisonjason@example.org,Question nothing data lead.,calvarez@example.org
2001-02-14 14:28:20,bartonjason,lopezbrittney@example.net,Child as everyone.,michael22@example.net
2001-02-08 06:42:20,marc27,wjohnson@example.net,Husband activity thank sometimes about rock.,hermandeborah@example.com
2001-02-09 13:12:52,sheri63,drichardson@example.net,Debate time over fund property.,stonechristopher@example.com
2001-02-17 10:42:53,wilkinsonjeffrey,virginiathornton@example.com,Task sort could federal Democrat accept.,joseph24@example.net
2001-02-11 01:04:06,powellkaren,beckerdylan@example.org,Conference hospital very necessary attack music.,wallacemiguel@example.com
2001-02-15 10:21:39,jacquelinebennett,laura62@example.net,Onto figure price wrong read.,margaretandrews@example.org
2001-02-17 08:15:42,crystal02,christina18@example.com,Figure American different free.,sheilagreen@example.com
2001-02-08 08:18:41,sarahbonilla,dhubbard@example.net,Animal cultural minute present.,lauren34@example.net
2001-02-16 04:05:49,denise78,matthewcline@example.com,Expert professor military.,linda67@example.com
2001-02-16 22:55:07,thorntonadriana,xmoody@example.net,Visit international class common office reality.,jacobwhite@example.com
2001-02-16 13:50:01,xsaunders,justin73@example.com,Every pay thought onto south.,robin08@example.net
2001-02-07 15:20:49,sandersandrew,randall16@example.net,Wall protect anyone speak pattern.,melissa86@example.net
2001-02-18 07:40:07,traviscooley,wendynewman@example.org,In apply glass trouble material moment space body.,christopher18@example.org
2001-02-09 11:27:48,osalazar,williamsjennifer@example.com,Speak window machine put.,carterrobert@example.com
2001-02-05 10:52:02,sandragomez,eric63@example.net,Sure kind main available may whose.,mendezjames@example.org
2001-02-09 05:55:45,brittneycunningham,glen64@example.org,Seek take rule exactly leg our option.,pclark@example.com
2001-02-07 03:22:19,jonathanbarton,donnadelacruz@example.org,Explain number tend society can position second.,cdavid@example.com
2001-02-11 09:45:37,thompsonstephen,aprilcollins@example.com,Firm system by yes machine senior field.,claudiawright@example.org
2001-02-06 07:07:22,clarkgrace,xlyons@example.net,Machine ago born determine evening large entire story.,wesleymedina@example.net
2001-02-09 09:05:22,rcooper,davidsonfrancis@example.com,Suddenly choice water.,whiteangela@example.net
2001-02-18 21:29:34,samantha54,kevin12@example.net,Lawyer appear field world ready threat world happy.,kylebrown@example.net
2001-02-14 02:51:43,acruz,ashleycampbell@example.net,Head kitchen sometimes there south agency.,odonnellmichael@example.com
2001-02-16 01:24:01,kellykyle,debrawilliams@example.com,Thousand analysis wide crime until.,sbell@example.org
2001-02-13 08:54:01,shepherdadam,michaelstuart@example.com,Bring begin poor leader always.,chenkatie@example.org
2001-02-11 15:04:16,beckbrent,michaelparks@example.net,War finish defense study score simply which model.,robert10@example.org
2001-02-14 15:34:17,jasonmartinez,cdavis@example.org,Employee land physical what or leg.,xhart@example.com
2001-02-18 03:26:14,paul53,douglasbishop@example.com,Relationship century write.,cwhitney@example.com
2001-02-13 17:24:51,lawrence31,sgarcia@example.net,Plan pretty forward.,hkennedy@example.net
2001-02-05 00:21:43,kimberly19,hamiltontiffany@example.org,Will drop open.,joshuadean@example.com
2001-02-07 20:09:30,haleyfoster,petersonjose@example.com,Close yourself whatever according.,mary40@example.com
2001-02-14 13:28:38,ryan78,jessemurillo@example.net,Success cell human good teacher have book.,thomasarroyo@example.com
2001-02-05 19:22:07,jonkrause,villanuevapatrick@example.net,Participant American young serve.,theresaperkins@example.com
2001-02-15 20:27:16,nataliewright,atkinsondavid@example.net,True person stage her just likely production once.,iaustin@example.net
2001-02-08 13:12:35,qdalton,fisherjennifer@example.com,Learn ahead growth none few somebody goal.,rachel99@example.org
2001-02-17 23:43:52,brooke15,danaglover@example.org,Describe serve include bank.,jasmin20@example.org
2001-02-17 21:03:47,christian70,devin73@example.net,Civil public sport partner foot again production.,samanthaharris@example.net
2001-02-07 16:57:29,xsmith,gregory29@example.com,Mouth the prepare assume share.,gonzalezjason@example.com
2001-02-10 11:43:30,xprice,nbryan@example.com,Space teacher question run star show.,qgomez@example.org
2001-02-05 05:12:47,pattersonjames,stephanie52@example.com,To son project tend any.,murphyjose@example.com
2001-02-10 02:54:28,bennettnicholas,stephen75@example.org,Sing enough here bit claim including night.,steventravis@example.com
2001-02-07 15:34:03,susanwong,christy49@example.com,That per war population we hotel street.,simondennis@example.com
2001-02-16 12:27:54,swilson,daniel89@example.net,Away approach age detail sit may again rule.,oharris@example.org
2001-02-07 19:28:12,veronica68,kelsey12@example.net,Writer evidence environmental word fast piece.,ericamartinez@example.net
2001-02-10 00:59:47,bthomas,kathryn36@example.com,Eight local per again.,abigailschultz@example.net
2001-02-07 11:00:25,alex84,katelyn78@example.org,Available development last evening.,vincent46@example.com
2001-02-09 16:54:45,howardjonathan,brian80@example.org,Sister window air.,caitlingreen@example.com
2001-02-19 07:57:30,fvincent,torrescesar@example.com,Help name lay woman blood make.,brianbrady@example.org
2001-02-07 18:26:40,bryanknight,stephenwhitney@example.net,Start much second who.,ramireztracy@example.net
2001-02-09 18:08:11,mirandajackson,berryscott@example.net,Through region first behind.,wdavenport@example.net
2001-02-08 14:23:50,kimberlytaylor,etyler@example.net,Understand start sell I.,josejones@example.org
2001-02-06 07:50:56,robertmartin,rreese@example.org,Writer defense care nothing.,qblankenship@example.com
2001-02-11 09:51:47,ronald17,smallrichard@example.com,Sister study also magazine like front.,choierin@example.net
2001-02-14 12:44:37,joshua19,samanthawilliams@example.com,Like kitchen seek ability.,amedina@example.net
2001-02-09 10:45:40,idavis,christianspencer@example.net,Success cost ready experience.,justin51@example.net
2001-02-19 11:56:02,heathdwayne,claytoncalvin@example.com,Parent at defense citizen end our.,matthewcline@example.com
2001-02-07 23:00:49,kathleen94,briannajohnston@example.org,Ahead case suddenly far guy whom community.,jfriedman@example.org
2001-02-14 18:46:02,igomez,michael12@example.com,Best enough discussion piece choose minute.,orozcotimothy@example.net
2001-02-14 10:59:00,wolfecarolyn,hilljulia@example.org,Mouth tough someone citizen player age.,nbrown@example.com
2001-02-15 23:12:09,john80,hughessarah@example.net,Former sister itself guy risk.,tonyameyer@example.net
2001-02-08 05:43:01,timothydavis,along@example.net,Property maintain environment interesting everything skin.,stephaniemiller@example.com
2001-02-12 04:17:28,davidgarza,oharris@example.org,Ok career course theory news week program surface.,jessica68@example.com
2001-02-05 00:36:50,brian40,bartonbeverly@example.org,Have policy once develop main cup.,hughessarah@example.net
2001-02-14 14:57:25,fordmichelle,patrickcalhoun@example.org,Where kid production whatever hair.,xevans@example.com
2001-02-18 13:09:49,robert08,jenniferhess@example.com,Same thank travel measure.,jeremysalazar@example.net
2001-02-15 15:19:42,michaelwalls,margaretandrews@example.org,Test company large why worry his.,michaelthomas@example.net
2001-02-10 23:53:39,clarkrobert,sarah24@example.com,Technology goal people positive record.,michael71@example.net
2001-02-07 12:06:12,lyonskaitlin,briannalawrence@example.org,Candidate line still management.,slynch@example.net
2001-02-11 08:22:59,urojas,william57@example.net,Moment without walk trouble fish few three.,joseph24@example.net
2001-02-11 22:55:30,kevin91,gary63@example.org,Establish sound wrong theory response paper professional.,austin69@example.com
2001-02-06 16:49:24,carlmartin,michaelthomas@example.net,Push threat quite everyone evening.,bradley11@example.com
2001-02-16 20:11:36,catherine62,ysutton@example.net,Although voice some in money.,erikaoconnor@example.org
2001-02-12 22:30:40,jonathanthompson,justin36@example.org,Available defense senior box baby.,williamstammy@example.org
2001-02-18 22:49:06,katherine37,heather25@example.org,Address while another ever class debate very network.,xmahoney@example.net
2001-02-08 18:54:16,ujohnson,riveranichole@example.org,Ok knowledge station team.,michellethomas@example.com
2001-02-05 13:19:30,matthew52,felicia45@example.com,Most play free line about.,sarah24@example.com
2001-02-12 22:30:40,georgetiffany,chumphrey@example.com,Check beautiful generation it truth group everybody yeah.,pfreeman@example.net
2001-02-17 06:39:45,alexander99,crystalthomas@example.com,Name life available first commercial fly law media.,ryan97@example.net
2001-02-11 01:04:06,derek13,lisa52@example.com,Heavy total interesting finally first church clear.,mgonzalez@example.org
2001-02-09 05:27:28,jillconway,erikaoconnor@example.org,Also talk even.,joshuacooper@example.net
2001-02-09 20:48:23,taylor02,thood@example.com,Ball get eight similar resource other indeed.,gonzalezjason@example.com
2001-02-14 08:36:21,andrewwilkerson,fergusonpam@example.org,Cultural brother lot it wide hour miss customer.,richard15@example.net
2001-02-17 22:30:49,kristychan,nthompson@example.org,Customer huge he statement social painting technology.,smithdavid@example.com
2001-02-18 12:41:16,elizabeth58,lunamark@example.net,Must Democrat forget rest more time around.,stacey28@example.org
2001-02-12 10:46:01,judy80,santanadaniel@example.com,Step occur he let.,ashleydominguez@example.org
2001-02-13 20:14:05,obriengeorge,mark42@example.com,Prevent another wind wife few face.,briannajohnston@example.org
2001-02-15 16:12:36,howardjonathan,brian80@example.org,Training drive side wide parent dark each.,martinezkenneth@example.net
2001-02-16 10:49:59,uwebb,mirandagail@example.net,Others know knowledge start.,christina80@example.com
2001-02-16 04:49:14,denisebates,xwalker@example.com,Police town every anything.,zunigajennifer@example.net
2001-02-13 05:37:23,yacevedo,erichorton@example.net,Baby perform play fight.,xhart@example.com
2001-02-11 08:42:44,troyallen,jessicahood@example.net,Science positive store cold industry.,keithlee@example.net
2001-02-09 05:27:28,sandersandrew,randall16@example.net,Kitchen account charge glass tend concern prepare.,cynthiajohnson@example.com
2001-02-06 19:54:25,kevin91,gary63@example.org,Environmental every special.,uadams@example.com
2001-02-05 08:13:05,eherring,richard15@example.net,Be sit not generation half war indeed.,mendezjames@example.org
2001-02-05 03:10:45,kellysalinas,chenkatie@example.org,Some century energy activity thought.,rmorris@example.org
2001-02-05 19:39:09,jonescharles,wkim@example.com,Plan cause north safe what receive point.,dbarr@example.org
2001-02-13 15:33:40,kimberly17,fergusondonald@example.net,Race ago down item dark full.,brownnicole@example.org
2001-02-11 00:53:31,wallerjoseph,christopherdecker@example.net,Second market push call sit.,ericchristensen@example.org
2001-02-11 12:05:45,rojasbrian,mmiller@example.com,Cup market town well dinner medical fill.,mbrock@example.org
2001-02-14 23:13:41,brian40,bartonbeverly@example.org,Old join central drug base relationship police image.,justin51@example.net
2001-02-10 07:23:11,jennyspencer,chelseajohnson@example.org,Above put become type step town.,sandra89@example.net
2001-02-15 07:16:46,cynthiadorsey,zhall@example.com,Hospital community third collection bank.,jmiller@example.net
2001-02-06 04:33:14,brittanyrussell,sarah42@example.net,Rise wait try environment.,josephmartin@example.com
2001-02-13 04:31:43,garyerickson,ronniebauer@example.net,Clear even local high star number.,raymond27@example.com
2001-02-09 07:56:20,cassandrabrown,lindashaw@example.org,There talk politics pick indicate that before.,ritaharper@example.org
2001-02-05 17:01:59,jillgoodwin,shanna@example.net,Cut although year enter garden practice reason.,xgomez@example.org
2001-02-13 08:54:01,courtney31,scottsanders@example.com,Sign including call school answer rest thus.,jessicasanchez@example.org
2001-02-08 04:56:53,duffyscott,mfoster@example.org,Staff large necessary door boy into coach.,williamsmartha@example.net
2001-02-06 06:18:36,williamsdavid,hallroy@example.com,Person interview notice sport one daughter front rather.,misty88@example.org
2001-02-14 11:04:35,adamstewart,greenjerry@example.com,Through bank choice ready activity away PM little.,daniel85@example.org
2001-02-05 05:42:09,angelaphillips,elewis@example.org,Us until answer network clearly far.,mbrock@example.org
2001-02-16 21:14:34,danielle68,joseph99@example.com,We stock specific security foot still man.,brownmario@example.net
2001-02-09 00:03:07,stevenperkins,ichung@example.com,Building list learn kid world season situation.,dennis78@example.net
2001-02-06 21:23:47,jeanne31,dwerner@example.net,Current dark former woman who.,matthewmccoy@example.net
2001-02-13 22:50:43,christinastout,webbjacob@example.com,Break check debate contain together.,zunigajennifer@example.net
2001-02-08 03:25:53,ithompson,cmichael@example.org,Perhaps time environment audience information.,jacksonbrandi@example.org
2001-02-08 03:22:58,robertsnicole,carterrobert@example.com,Improve if red western agency forward.,stevemeyer@example.org
2001-02-17 03:55:37,bradlewis,danielsoto@example.org,List source history film grow business make consider.,lawrence28@example.com
2001-02-08 02:10:39,batesalexander,juliawells@example.com,Seven career bag theory seem operation yeah.,cindy40@example.org
2001-02-18 07:53:52,kimberlytaylor,etyler@example.net,Democrat including subject stop.,cody75@example.org
2001-02-05 05:42:09,davidgarza,oharris@example.org,Wear crime toward edge draw fish.,david11@example.net
2001-02-09 03:34:52,moconnor,leeamanda@example.org,Three own each onto admit many.,sheilagreen@example.com
2001-02-13 13:08:12,jlopez,lisajohnson@example.org,Power choice development develop surface follow.,williamsjennifer@example.com
2001-02-08 10:00:31,crystal52,nicolas47@example.org,Argue thus treat cup.,renee97@example.org
2001-02-13 08:55:43,kenneth29,wilkersonjacqueline@example.com,Nature us this much with.,nicoledecker@example.net
2001-02-05 10:14:19,gregorysanchez,toni45@example.com,North physical certain newspaper.,along@example.net
2001-02-17 03:44:50,anthonyjeremy,nrodgers@example.org,Consumer beautiful ready interview.,michael22@example.net
2001-02-15 19:03:26,patrick05,shelly67@example.org,Economy center necessary yard check.,nicolas47@example.org
2001-02-17 23:24:54,gilbert92,nmckenzie@example.com,Would field system.,kaitlyn32@example.net
2001-02-17 01:46:33,kprice,david17@example.net,Lawyer east yet among production air analysis common.,ssmith@example.net
2001-02-14 10:38:40,carlmartin,michaelthomas@example.net,Song together very happen set.,jlopez@example.net
2001-02-11 19:24:12,vharvey,jacksonlindsay@example.org,Prove recognize reduce type inside however mother event.,richardsjesus@example.com
2001-02-10 14:20:30,stephanie45,taylor29@example.com,Dog white alone training military.,jgonzalez@example.net
2001-02-06 18:10:29,garyerickson,ronniebauer@example.net,They beyond pay step theory fear.,schneiderjessica@example.org
2001-02-19 04:11:00,jeremiahcolon,sandersdaniel@example.net,Through letter skill front card woman government.,dcraig@example.net
2001-02-05 17:14:38,sharpalexander,bjoseph@example.net,Kid open event American.,anthonyday@example.net
2001-02-15 11:24:51,camachochristine,ktaylor@example.net,Age avoid center drop think.,saunderslaura@example.com
2001-02-12 05:49:57,mcneilsusan,john06@example.com,Economy young seat.,sbell@example.org
2001-02-05 14:03:49,xlarson,leroygomez@example.net,Explain effort accept simple look people free.,pcarney@example.net
2001-02-14 08:19:20,rhondakim,uwells@example.com,Apply else live hit knowledge.,thood@example.com
2001-02-17 02:27:14,julie10,hornsarah@example.org,Occur health development source skin worker late.,kimberly42@example.net
2001-02-18 09:34:07,crystal02,christina18@example.com,Teacher task develop trip outside.,anthonylove@example.com
2001-02-14 06:02:50,zacharygarcia,kerrchristy@example.net,Itself season avoid question build actually as.,kylie13@example.com
2001-02-10 11:02:51,odoyle,cody75@example.org,Exactly show own dog wait same.,ray42@example.org
2001-02-13 09:21:03,imccoy,vanessalawrence@example.com,Other simple parent.,mary40@example.com
2001-02-19 05:49:06,zbooth,wford@example.com,Partner surface several recently expect partner policy.,heather53@example.org
2001-02-16 22:55:07,xgutierrez,qblankenship@example.com,Truth leg nothing since.,jrodriguez@example.com
2001-02-06 00:12:03,latoya13,wallacelaura@example.org,General control such morning hotel player trouble.,kelsey12@example.net
2001-02-09 01:46:10,jwilliams,claudiawright@example.org,Decision himself development chance direction.,weeksrichard@example.org
2001-02-18 05:59:56,susan92,tvincent@example.com,Success positive tax member blood nature second.,xhart@example.com
2001-02-17 19:29:43,victoriablair,angelaadams@example.org,Watch industry best through mention degree that.,ywilkins@example.net
2001-02-07 12:55:55,perrychristine,olsonronald@example.com,House public process high many message control.,michellethomas@example.com
2001-02-11 07:48:49,craig71,kathryn49@example.com,Situation against street everybody.,juliawells@example.com
2001-02-06 19:33:27,cheryljackson,patrick02@example.com,Protect physical claim traditional allow guy industry sit.,chumphrey@example.com
2001-02-08 06:42:20,amberbyrd,xevans@example.com,Civil record professional fund anything dinner.,austin69@example.com
2001-02-18 02:53:47,ajohnson,myu@example.com,After lawyer student note article floor.,yharris@example.net
2001-02-16 07:33:51,baxtermonique,melissa86@example.net,Interesting Congress help institution section.,megan08@example.com
2001-02-12 17:30:57,robinsondeanna,amanda98@example.com,Rule law our.,debrawilliams@example.com
2001-02-12 17:51:20,stewartanthony,ycole@example.net,Our official only set the rise.,mmiller@example.com
2001-02-06 07:07:22,jasonponce,rebecca14@example.net,Describe few official several language.,rsimpson@example.com
2001-02-11 22:04:28,martintodd,riveradaniel@example.net,Development at wall beautiful college page.,tanyalewis@example.com
2001-02-11 22:10:21,robert87,jacksonjames@example.org,Rule listen return wall concern think sing drug.,glen64@example.org
2001-02-08 15:35:39,michaeljohnson,ronnierodriguez@example.org,People use set religious.,schwartzpaul@example.com
2001-02-13 01:46:12,villaashley,juan60@example.net,Sing class western matter blue.,candice67@example.net
2001-02-12 03:20:32,swansondonna,jermainejohnson@example.net,Lot method own method land else.,glen64@example.org
2001-02-14 07:26:55,denise78,matthewcline@example.com,Bar military clear should fight.,melaniedaugherty@example.org
2001-02-16 18:59:24,carrollpeter,robertlee@example.org,Scientist guy end buy physical rock.,heather25@example.org
2001-02-07 07:16:33,avilamatthew,jennifer27@example.net,View analysis future someone story find.,christopherhernandez@example.org
2001-02-10 09:50:22,arthur20,smoore@example.net,Suffer low behavior different spring.,morrisonjacob@example.com
