timestamp,user_id,from,content,to
2001-02-09 21:57:59,fwhite,tannerlori@example.org,Likely none work me dream try.,cwhitney@example.com
2001-02-10 02:44:04,gbird,lisasanchez@example.net,Coach into key chair allow compare.,christopherdecker@example.net
2001-02-07 05:35:53,horngary,matthew29@example.com,Spend perhaps source per while would should race.,mpatterson@example.net
2001-02-14 13:56:57,denniswhite,davismatthew@example.com,Sometimes item couple environment wife line marriage.,sjohnson@example.com
2001-02-15 00:59:47,joshuavasquez,nicole16@example.com,Participant Mrs add garden those once.,davisjames@example.com
2001-02-18 14:34:02,nweeks,paigetodd@example.org,Success local thought analysis employee help.,qblankenship@example.com
2001-02-10 17:09:50,manueltorres,brownkathryn@example.net,Very conference anything program particularly value respond.,schmitthenry@example.net
2001-02-10 06:03:53,shepherdjennifer,santiagojoshua@example.net,Soon professor school draw.,vmooney@example.com
2001-02-09 17:11:31,derek13,lisa52@example.com,Perhaps marriage meeting foot.,mmiller@example.com
2001-02-09 18:04:37,robert26,debra78@example.net,Of doctor seek safe rise system today.,huffgeorge@example.org
2001-02-18 10:52:59,bennettnicholas,stephen75@example.org,Determine hit same.,shanna@example.net
2001-02-13 04:18:29,jowens,stephenhernandez@example.org,Political trip write game yet name together.,robertcrosby@example.net
2001-02-09 01:07:07,lindsey53,hkennedy@example.net,Product source power return.,jessemurillo@example.net
2001-02-18 23:36:08,robertowatson,allisonparsons@example.org,Store approach anyone late.,hvasquez@example.net
2001-02-18 04:42:32,karenrice,daniel85@example.org,Subject however near six treatment you hour.,patrick02@example.com
2001-02-16 08:00:00,robertsnicole,carterrobert@example.com,I many material become play yes.,ryanshannon@example.com
2001-02-05 19:47:22,garcialisa,stoutjoe@example.net,Theory learn grow guy.,angelachambers@example.org
2001-02-11 02:42:30,rebeccawright,warrencarol@example.org,Not smile population outside.,bjohnson@example.net
2001-02-10 09:17:53,daniel62,anthony50@example.net,Else perform foreign on kitchen new how adult.,chumphrey@example.com
2001-02-18 22:24:21,garyjackson,cruzdeanna@example.org,Somebody short include treatment.,chelseavelazquez@example.org
2001-02-18 05:54:27,kellykemp,schneidernicholas@example.com,World tell know coach.,wilkinsonapril@example.net
2001-02-09 02:59:39,darlene24,jonathan68@example.net,Science area throughout only spring not.,mvasquez@example.com
2001-02-12 07:17:54,gordonfrench,melissalevy@example.net,Series article according build less moment.,fisherjennifer@example.com
2001-02-19 03:40:45,kellykyle,debrawilliams@example.com,Everyone last south individual note fall threat.,sean30@example.org
2001-02-16 08:07:20,tonyabowers,bryantlogan@example.org,Style future institution start only future follow.,joy35@example.net
2001-02-19 06:32:59,tammycurtis,cummingsreginald@example.org,Throughout reflect trouble involve structure everybody catch exist.,atkinsondavid@example.net
2001-02-07 22:08:47,ibright,christine27@example.org,Than success within stop.,grichmond@example.net
2001-02-12 11:55:55,jskinner,wkelley@example.net,Machine enjoy establish cold meet oil.,clarkkristi@example.net
2001-02-17 00:46:33,david95,earlwalls@example.com,Budget side artist.,iaustin@example.net
2001-02-15 06:23:51,harrisdeborah,amydixon@example.com,Poor most population third car door us.,paigetodd@example.org
2001-02-13 22:14:12,eschmitt,jackiepeterson@example.net,Experience their quickly.,raymondjones@example.com
2001-02-06 18:14:55,phillipsemma,jacksonbrandi@example.org,Group interview open spend chance goal.,dianawarner@example.com
2001-02-12 14:34:27,tiffany02,athompson@example.com,War education dream much various blue.,heather25@example.org
2001-02-10 18:31:43,powelljennifer,swilson@example.com,Pass high three similar bill against.,christopherdecker@example.net
2001-02-09 20:36:41,peterherrera,kennethmullins@example.com,Energy upon ready cut affect name street building.,collinsmark@example.net
2001-02-09 03:03:17,uthornton,mvasquez@example.com,Health fund end small early station put over.,joann65@example.org
2001-02-10 23:21:10,frostdavid,laura14@example.com,His look exactly their type thus city real.,wendynewman@example.org
2001-02-06 02:23:39,kevinmcclain,ianmoyer@example.com,Ground family sense tend consider.,cummingsreginald@example.org
2001-02-14 23:25:57,newtonnatalie,pburns@example.com,Candidate purpose amount response style know raise discover.,amandagarrison@example.com
2001-02-07 20:25:55,pamela35,jgonzalez@example.net,Realize entire black yes day little.,michellejenkins@example.net
2001-02-17 05:11:22,bryanguerrero,cindy06@example.org,Left huge summer magazine song executive loss material.,cummingsreginald@example.org
2001-02-07 04:39:39,briancummings,osborndaniel@example.net,Though bar class sense try cup.,cwood@example.org
2001-02-07 16:13:24,patricianichols,rmorris@example.org,Game meet reveal someone.,ycole@example.net
2001-02-17 17:25:08,veronica68,kelsey12@example.net,Go develop life.,austin69@example.com
2001-02-06 04:33:14,andersonmichele,smithlee@example.com,Truth administration class big economic.,santiagosummer@example.com
2001-02-15 00:30:58,iellis,dmiller@example.net,Determine time themselves.,bakermaria@example.net
2001-02-06 10:26:40,clarkgrace,xlyons@example.net,Southern idea fast wall.,zhartman@example.net
2001-02-13 05:02:09,pflores,joshua06@example.net,Present respond either yard recently sister.,crodriguez@example.org
2001-02-14 08:17:15,james31,austin69@example.com,Community state station century research light.,paigetodd@example.org
2001-02-16 14:05:24,tiffany02,athompson@example.com,Near along father leader tree particular.,jfriedman@example.org
2001-02-10 22:48:49,linda75,bhansen@example.org,Evidence nearly yes hair.,alexanderlopez@example.com
2001-02-06 09:36:18,barkerrobert,sandrawagner@example.net,Material one tough place phone media imagine.,rsimpson@example.com
2001-02-12 15:43:42,carlmartin,michaelthomas@example.net,Building mission sing go same.,jennifer27@example.net
2001-02-13 23:53:21,sdavis,tristanwilliams@example.org,Similar idea help sea.,jasonjackson@example.org
2001-02-08 06:35:42,christopher53,richardsjesus@example.com,Choice red our guy ok.,nmitchell@example.com
2001-02-06 16:47:26,robert26,debra78@example.net,Sometimes eye chance amount those put.,lbarron@example.net
2001-02-15 15:32:55,amberbyrd,xevans@example.com,Father past Mr use necessary story director human.,raymondjones@example.com
2001-02-14 15:33:15,rbutler,dennisbuchanan@example.net,Citizen you it coach edge heart maintain.,danaglover@example.org
2001-02-16 20:09:45,jonathaningram,bryan22@example.com,Office buy health without bad.,danaglover@example.org
2001-02-17 05:55:19,pacebarbara,jonesvanessa@example.com,Lead phone type have add hope.,hvilla@example.org
2001-02-05 21:58:22,natalie54,jamesmartinez@example.org,Rich fact color card.,mitchellchristopher@example.org
2001-02-18 22:19:53,lisa70,millersuzanne@example.net,Far hour technology management every cultural appear deep.,ebates@example.net
2001-02-08 13:47:32,howardtara,kylebrown@example.net,When present perhaps move.,sbell@example.org
2001-02-16 19:59:38,terriramos,dromero@example.org,Reason happen threat important data.,moniquewalker@example.com
2001-02-06 13:26:07,latoya13,wallacelaura@example.org,Single beautiful sing major Mr.,tonyameyer@example.net
2001-02-09 09:05:22,pricekaylee,amyjimenez@example.com,Produce still road enough.,nrodgers@example.org
2001-02-08 14:20:22,cody56,jorgethomas@example.org,Science drug throughout.,daniel05@example.org
2001-02-09 10:37:10,eric28,valerie08@example.com,Receive set physical at husband stay add part.,kelsey12@example.net
2001-02-05 01:02:00,brittanymcbride,aduffy@example.com,Quickly floor let oil eight good.,millersuzanne@example.net
2001-02-16 01:22:14,mccormickshannon,fowlerlauren@example.org,Couple similar memory office.,juan60@example.net
2001-02-19 05:20:31,mlee,ryanshannon@example.com,Commercial administration attention food.,carl51@example.org
2001-02-17 11:01:24,davisdavid,grichmond@example.net,Feel himself international science explain yet bag.,joshua06@example.net
2001-02-13 12:24:48,cpalmer,abennett@example.org,Rise save politics upon.,briannalawrence@example.org
2001-02-05 15:17:47,olsonantonio,craigthomas@example.org,Likely something Democrat election option.,glenn66@example.com
2001-02-05 07:59:32,jillgoodwin,shanna@example.net,Yet general hope myself.,kevin03@example.org
2001-02-07 12:00:39,jonathaningram,bryan22@example.com,Technology kid rise contain ever.,alexanderlopez@example.com
2001-02-11 02:12:20,williambates,sarazimmerman@example.net,Why build local reality.,kelsey12@example.net
2001-02-08 17:18:24,james31,austin69@example.com,Society score course bad simple region decide.,richardsonalyssa@example.net
2001-02-06 09:16:06,gabrielmiranda,jeremiah03@example.net,Six house lot method within control just.,zunderwood@example.net
2001-02-06 07:49:05,dawn18,murphyjose@example.com,Sign price majority look international condition.,nmckenzie@example.com
2001-02-10 06:22:27,ehicks,daniel03@example.org,Back culture history bill fine law difference.,schneiderjessica@example.org
2001-02-17 05:13:13,robert02,morrisgabriel@example.org,Early lot employee voice available whom opportunity.,mgonzalez@example.org
2001-02-11 02:36:30,dchapman,michelle59@example.com,Total ask public wait.,wrightsarah@example.net
2001-02-16 22:22:34,gcervantes,wpierce@example.net,Player single inside build but sure.,peter95@example.net
2001-02-16 07:20:35,stevensvictoria,uallen@example.org,Piece they most only.,amyjimenez@example.com
2001-02-18 21:29:34,barnesstephanie,danielcastaneda@example.net,Spring agency east.,xboyd@example.org
2001-02-19 11:22:57,joshua19,samanthawilliams@example.com,Protect total court city shoulder.,norrisdaniel@example.org
2001-02-18 06:57:27,sara60,davidwilliams@example.net,New worry move democratic parent Democrat hotel.,stevenmartinez@example.org
2001-02-08 01:14:28,kevin11,cheryl76@example.org,Attention hot protect office dream everyone accept.,wsanchez@example.net
2001-02-15 11:16:54,rbarber,cjackson@example.net,Become hit consumer step staff.,kevin12@example.net
2001-02-18 02:29:39,medinaronald,lori88@example.net,Area mean fish believe economic doctor.,martinezmichelle@example.net
2001-02-12 15:22:03,austinlamb,lutzjoel@example.com,Country sign hour.,diane86@example.com
2001-02-11 11:05:35,pameladyer,fsmith@example.net,Here wind apply music.,manndaniel@example.org
2001-02-15 15:36:44,janet40,mclaughlinshannon@example.net,Difficult country support receive describe popular generation.,rmorris@example.org
2001-02-18 04:08:32,htaylor,omcintosh@example.net,Bring we certainly doctor seek.,bradley35@example.net
2001-02-05 09:47:48,heidihernandez,josearnold@example.com,Loss old woman somebody true growth glass.,nrodgers@example.org
2001-02-06 07:07:22,fordmichelle,patrickcalhoun@example.org,Water stand common technology.,andrea52@example.net
2001-02-17 15:09:42,christensensara,cynthiajohnson@example.com,Industry tonight home change money house actually.,norrisdaniel@example.org
2001-02-17 20:06:50,mooremichelle,tammy61@example.org,Painting test effort offer person well street.,eric78@example.org
2001-02-12 00:18:32,dylanhorn,bonnieholland@example.org,Beat itself by trade.,draketammy@example.org
2001-02-18 15:52:43,melissa96,karen28@example.org,Central receive can cultural down focus.,murphyjose@example.com
2001-02-13 11:18:15,jennifer25,jacksonmichelle@example.com,Action under day her middle pressure relationship.,ericcooper@example.net
2001-02-13 20:25:17,jacob53,peggymccann@example.org,Themselves agreement stuff.,ashleywilliams@example.net
2001-02-09 16:18:15,joseph65,chapmanteresa@example.com,Experience tonight could management section fill.,nibarra@example.com
2001-02-18 19:24:27,leesharon,heather53@example.org,Information operation yeah view.,smithangela@example.net
2001-02-13 02:11:49,raymond97,lewissherry@example.org,With get company imagine certain process value.,ellen53@example.org
2001-02-17 05:15:09,josepharellano,christopher18@example.org,Different friend table most offer.,david11@example.net
2001-02-11 08:36:22,vanessa56,christinabates@example.com,Man audience would issue scientist sure buy.,cody75@example.org
2001-02-10 16:04:20,linda65,randalldavis@example.org,Response rise point clearly get.,asanchez@example.net
2001-02-12 12:24:52,victoriablair,angelaadams@example.org,Mouth assume media from crime city candidate.,norrisdaniel@example.org
2001-02-08 12:25:16,angelica21,kaylahicks@example.net,Bit really herself act about.,mmiller@example.com
2001-02-13 14:22:22,ortizdominic,stevemeyer@example.org,Number change until federal.,pperry@example.org
2001-02-07 05:54:39,jonkrause,villanuevapatrick@example.net,Morning left example eye.,garciajames@example.com
2001-02-10 18:48:03,lisathomas,fernando11@example.net,Establish note person business.,kingnicole@example.net
2001-02-10 18:35:06,mcneilsusan,john06@example.com,Others student half agree adult again dog contain.,michaelrojas@example.net
2001-02-05 18:39:56,bbutler,jacobstammy@example.org,Treatment sing myself include.,hammondkatherine@example.org
2001-02-15 16:31:21,opatterson,caitlingreen@example.com,Than prevent impact population.,wdavenport@example.net
2001-02-06 07:49:05,christopheredwards,gatesjason@example.org,Subject act film training president.,katelyn78@example.org
2001-02-11 04:22:24,ortizallison,bjones@example.net,Group far discussion side benefit.,alexanderedwards@example.org
2001-02-07 00:45:13,stephanie38,kimberlymccarthy@example.net,Fear before seem front force radio note apply.,aevans@example.com
2001-02-08 18:07:54,mgomez,meganweber@example.org,None just themselves season under.,cody75@example.org
2001-02-07 23:31:23,fdennis,joseph98@example.net,Smile side nor customer.,xrogers@example.org
2001-02-12 03:17:41,dbrown,kathleenmalone@example.com,Discussion identify late return step where focus statement.,andrewsscott@example.com
2001-02-17 22:55:50,williamscurtis,malloryhines@example.com,Still of stuff.,williamswilliam@example.com
2001-02-07 14:03:40,kwilson,lsmith@example.org,Word already parent.,keith48@example.com
2001-02-17 06:19:56,christian70,devin73@example.net,Early management mother lose wish.,justinjones@example.org
2001-02-06 17:50:13,youngpam,qhicks@example.net,Final no evening free.,vincent46@example.com
2001-02-08 06:29:59,jwilliams,claudiawright@example.org,Sit worry range hundred describe.,kathryn14@example.org
2001-02-17 05:58:05,tacevedo,umorgan@example.net,Still site better fall art born recognize on.,nelsonnichole@example.com
2001-02-18 14:20:05,raymond97,lewissherry@example.org,Exactly low forward popular.,dereknguyen@example.net
2001-02-12 10:27:05,fishermichael,cunninghamrichard@example.org,Together indeed PM deal subject can situation in.,dromero@example.org
2001-02-08 13:14:19,jasonmartinez,cdavis@example.org,Share table local soldier.,lwang@example.com
2001-02-11 16:25:02,danielle53,cynthia40@example.net,Market pass building.,anthonyedwards@example.org
2001-02-06 13:12:55,edwin25,hermandeborah@example.com,Model plant whether while positive various later.,jasonjackson@example.org
2001-02-10 15:51:44,sheri63,drichardson@example.net,Player poor them also important focus lead project.,zimmermanaudrey@example.net
2001-02-10 09:46:59,churchchristine,theresaperkins@example.com,Poor instead ok within future.,uallen@example.org
2001-02-10 19:54:30,reginald07,guzmanashley@example.org,Which medical better building news.,bradley35@example.net
2001-02-13 11:08:29,kevin91,gary63@example.org,Political allow old dream dinner middle.,zlewis@example.com
2001-02-19 12:30:15,olsonantonio,craigthomas@example.org,Sound economic hot and radio.,ronnierodriguez@example.org
2001-02-19 01:55:00,gilbertray,tvargas@example.net,Apply common become after statement expert.,jonathanfowler@example.org
2001-02-10 17:33:30,anthony51,michaelmalone@example.com,Study person pressure green choice.,alexanderrobert@example.com
2001-02-19 10:03:55,pamela60,kevin03@example.org,Today provide agency heavy anything involve.,ericcooper@example.net
2001-02-11 17:54:21,lisa56,ashleywilliams@example.net,Site maybe you interesting present.,jenniferhess@example.com
2001-02-05 06:59:22,shawn47,reneewilliams@example.com,Positive trip beat everyone place.,xwalker@example.com
2001-02-07 12:18:13,xstanley,kingnicole@example.net,Opportunity view fine worry thus.,nbrown@example.com
2001-02-05 05:47:39,aprilwood,lgarcia@example.org,Just mind kind.,stephaniebryant@example.org
2001-02-08 21:11:28,vharvey,jacksonlindsay@example.org,Sing upon prevent perform.,fisheranthony@example.com
2001-02-05 12:24:51,denniswhite,davismatthew@example.com,Her perhaps population nice may the.,hicksjamie@example.com
2001-02-15 08:48:22,xhamilton,alejandro44@example.net,Yes together will perhaps such couple.,andrewstamara@example.com
2001-02-18 22:03:33,tonyabowers,bryantlogan@example.org,Seven century evidence full.,robersonaaron@example.com
2001-02-08 14:35:56,susancook,yblackwell@example.org,Avoid chair data.,dmorris@example.org
2001-02-17 23:24:54,shelley74,angelacampbell@example.net,Each heart protect.,tracy76@example.net
2001-02-07 13:57:45,xsmith,gregory29@example.com,Sit free sense science.,berryscott@example.net
2001-02-10 05:34:15,ashleefloyd,hvasquez@example.net,Follow crime lay vote blue popular.,nbrown@example.com
2001-02-10 22:02:32,danielle68,joseph99@example.com,According type state daughter.,ebates@example.net
2001-02-17 08:34:00,bennettkimberly,alexanderedwards@example.org,Activity must provide respond parent child.,elewis@example.org
2001-02-06 19:33:27,kellydaniel,oross@example.net,Chance moment remember short local school capital.,jessica68@example.com
2001-02-14 07:46:50,kevin14,schoi@example.com,Offer loss should.,umorgan@example.net
2001-02-13 02:26:47,maldonadomarcus,kaylawilson@example.net,View child energy thousand.,melanieklein@example.com
2001-02-09 01:00:07,matthewkelly,ytaylor@example.org,Today her heavy job environmental tough authority realize.,omcintosh@example.net
2001-02-18 14:51:07,thompsonjorge,reidjoseph@example.com,Speak ok something chance hour.,jeremysalazar@example.net
2001-02-11 07:57:02,matthew52,felicia45@example.com,Picture school possible recently meeting property.,bjoseph@example.net
2001-02-13 18:23:18,taylorheath,andrea11@example.com,Represent provide learn.,uwalker@example.net
2001-02-17 17:07:07,sscott,gutierrezsean@example.org,Likely chance head second raise lot fund.,alexanderlopez@example.com
2001-02-07 12:06:12,pharris,christina80@example.com,Dog discussion voice impact continue as near.,regina40@example.org
2001-02-11 02:10:09,horngary,matthew29@example.com,Energy option first them.,tracy47@example.net
2001-02-13 12:19:53,timothy25,dianawarner@example.com,Push watch hour environment arrive dog human.,justin36@example.org
2001-02-14 22:52:37,rachelmarshall,pperkins@example.com,Authority charge bill our argue speech five.,stevenvalencia@example.com
2001-02-17 10:52:04,robertmartin,rreese@example.org,Wife dark beautiful fill remain.,brittneycunningham@example.net
2001-02-12 14:45:57,umueller,ronaldford@example.org,Behind go analysis rate.,bradley66@example.org
2001-02-09 19:44:37,courtneysanchez,brittneycunningham@example.net,Identify short pretty without her manage choose.,margaretandrews@example.org
2001-02-08 00:13:10,markperry,nathanmcclain@example.net,Stop let number story because end.,david17@example.net
2001-02-11 10:18:42,ehunt,morrisonjason@example.org,Read final bank.,scastillo@example.com
2001-02-09 02:01:27,brandimartin,ramireztracy@example.net,Guy hold ever away.,qgomez@example.org
2001-02-10 15:28:42,abrown,keith71@example.org,Actually fear ago single right certainly.,hammondkatherine@example.org
2001-02-05 01:27:21,jonathaningram,bryan22@example.com,Find white TV body major.,haley38@example.org
2001-02-13 13:09:49,dawn18,murphyjose@example.com,Affect general color each remember conference.,campbellfelicia@example.org
2001-02-16 02:16:51,kbenson,martinezmichelle@example.net,Million up loss some these old response give.,barry15@example.org
2001-02-17 05:47:57,patrickrivera,mbrock@example.org,Administration song program.,yoderfaith@example.com
2001-02-09 11:49:30,thomas78,garciacatherine@example.net,Under south serious explain up forget.,camachoashley@example.org
2001-02-19 00:33:01,sharonromero,jessicasanchez@example.org,Pick region compare whose Republican.,mary30@example.com
2001-02-13 11:26:39,johnmclean,cdavid@example.com,Fear doctor professional street.,smithanthony@example.net
2001-02-14 11:18:17,phillipsmatthew,rodom@example.net,Lead same mother carry information enough approach example.,eugene48@example.net
2001-02-17 06:04:57,ctravis,andersonteresa@example.com,Cell write discussion time prevent smile.,csanchez@example.org
2001-02-13 13:59:30,josephdavis,pfoley@example.org,Few determine quite smile professional large glass.,charlesramirez@example.net
2001-02-15 16:22:18,katherine61,orozcotimothy@example.net,Third stuff benefit figure experience fish meet.,brian83@example.org
2001-02-07 12:00:39,ynelson,heather04@example.com,Resource interesting lose our.,meganweber@example.org
2001-02-12 22:08:20,timothy25,dianawarner@example.com,Magazine value million cut.,glenn66@example.com
2001-02-14 17:26:42,sdavis,tristanwilliams@example.org,Seek report beyond computer.,monica51@example.com
2001-02-11 16:03:21,colleendixon,abond@example.com,Page suffer arm skill.,logan94@example.net
2001-02-15 23:54:26,kwilson,lsmith@example.org,Start great sit race participant.,raymond27@example.com
2001-02-11 09:24:38,kellykyle,debrawilliams@example.com,Its itself court marriage.,daniel85@example.org
2001-02-18 08:23:59,jjones,mccormickbarbara@example.net,Public enjoy between beyond about two.,ellen53@example.org
2001-02-08 07:47:41,michaelwalls,margaretandrews@example.org,Feeling eye reflect determine ago.,lirobert@example.com
2001-02-05 15:50:12,markhill,coopersuzanne@example.com,Shake son product property tend they.,jennifer81@example.org
2001-02-09 04:14:31,nicole55,bakermaria@example.net,Beautiful himself apply cultural huge American charge.,collincombs@example.org
2001-02-16 11:42:08,xayala,patricknelson@example.com,Road face standard agreement such single style.,kathy35@example.com
2001-02-18 20:42:06,dphillips,charlesramirez@example.net,Reduce news get national in although.,joshuaarnold@example.com
2001-02-09 20:48:23,alan35,cholland@example.net,Five on deep between.,saunderssharon@example.net
2001-02-08 10:03:05,heather35,dhurst@example.net,Late enough say benefit.,rreese@example.org
2001-02-09 00:48:27,kevin21,pattersonrobert@example.net,Term budget father second meet statement majority.,umorgan@example.net
2001-02-17 03:29:58,mendozaaaron,gwelch@example.net,Majority talk within break on industry.,randall16@example.net
2001-02-16 01:19:50,anthony51,michaelmalone@example.com,Coach party necessary company determine fine science.,jcrawford@example.org
2001-02-13 15:40:36,natalie54,jamesmartinez@example.org,Well region skill if cut.,robertsmiguel@example.net
2001-02-18 05:46:38,james31,austin69@example.com,Tree down personal power you develop.,jessica68@example.com
2001-02-17 03:17:51,michealsmith,david11@example.net,Far only close wonder heavy.,frogers@example.org
2001-02-14 17:19:09,qbradley,jennifer81@example.org,Trip dinner human than.,davisrandy@example.net
2001-02-10 08:47:48,mcconnelldylan,wperez@example.net,Once hotel offer.,cgarcia@example.com
2001-02-16 10:35:59,haleyhoward,brittanyford@example.com,Goal cut building my.,crodriguez@example.org
2001-02-09 01:50:56,johnsonchristina,phyllisescobar@example.com,Not Mr process might.,chapmanbilly@example.net
2001-02-16 07:38:18,dudleyrhonda,peterphelps@example.org,Every event open care least.,hgonzalez@example.org
2001-02-18 03:39:08,audreyadkins,matthewcook@example.com,West identify involve reveal media too push.,stevenvalencia@example.com
2001-02-07 21:49:01,katie78,zunderwood@example.net,Like close country reduce left federal expert.,zimmermanaudrey@example.net
2001-02-08 13:13:33,perrychristine,olsonronald@example.com,Center you political feeling whose meeting word conference.,tannerlori@example.org
2001-02-12 16:05:29,khernandez,kendracarpenter@example.org,Explain travel lose street environment third meet smile.,tinashaffer@example.net
2001-02-10 07:36:00,aaron64,tamara89@example.com,Stuff mention actually deal seem politics describe.,vgomez@example.net
2001-02-17 11:24:11,shawn47,reneewilliams@example.com,Sell market per community nothing lot serious little.,atkinsonveronica@example.org
2001-02-05 21:44:09,ehicks,daniel03@example.org,Author full say manager.,shelly67@example.org
2001-02-11 23:10:16,courtney31,scottsanders@example.com,Town quickly community activity answer.,olsonronald@example.com
2001-02-15 18:23:55,huntercraig,bowendonald@example.org,Teacher until administration man his.,slynch@example.net
2001-02-11 12:34:46,hernandezkaren,misty88@example.org,Skin control source stop example cup what radio.,robersonaaron@example.com
2001-02-12 03:53:38,imccoy,vanessalawrence@example.com,Less bag something picture man probably.,draketammy@example.org
2001-02-08 18:33:23,sscott,gutierrezsean@example.org,Tv society difference affect name rise no.,lisasanchez@example.net
2001-02-13 23:34:39,gwilliamson,moorejames@example.com,Only likely campaign success few your.,johnsonrobert@example.com
2001-02-18 05:42:10,lisasmith,anna68@example.org,Huge institution blue for.,paigetodd@example.org
2001-02-10 17:33:30,jeremiahcolon,sandersdaniel@example.net,Level brother attack when follow open dark.,thomascontreras@example.org
2001-02-10 09:10:42,robertsmith,scottsellers@example.com,Away national trial lot recent.,alex61@example.net
