timestamp,user_id,from,content,to
2001-02-05 16:34:29,gregorysanchez,toni45@example.com,One culture blue outside in policy.,santiagosummer@example.com
2001-02-07 00:46:37,martinezgloria,zrosales@example.org,Collection within manage hair campaign protect strong.,wilsonvalerie@example.com
2001-02-07 14:37:47,juliapalmer,kelsey43@example.net,Score memory TV this.,qflowers@example.com
2001-02-18 15:10:49,lyonskaitlin,briannalawrence@example.org,Southern add throughout five.,fergusonpam@example.org
2001-02-11 21:33:19,thompsonjorge,reidjoseph@example.com,Level business record society civil teacher.,morrisgabriel@example.org
2001-02-08 16:18:46,moniqueporter,choierin@example.net,Answer hold practice article.,zunigajennifer@example.net
2001-02-12 15:43:42,wilsontimothy,fthomas@example.net,Plant dream floor whole employee.,kurt41@example.com
2001-02-11 05:43:40,katherine61,orozcotimothy@example.net,Leader still former almost suddenly north between.,briannalawrence@example.org
2001-02-17 04:31:57,vincentmartinez,rachel99@example.org,General generation those less individual.,david17@example.net
2001-02-07 13:16:32,john37,gclarke@example.net,Need owner meeting center.,robert10@example.org
2001-02-14 00:28:12,kimjoseph,mitchellchristopher@example.org,Travel health first son.,wjohnson@example.net
2001-02-13 08:19:53,ttucker,herbert85@example.org,Dark research change blue left throw food newspaper.,william14@example.net
2001-02-08 11:12:49,zgarcia,hhood@example.net,Decision significant ok sound cold six.,olsonronald@example.com
2001-02-09 17:36:46,othomas,tinaelliott@example.org,Morning instead everything hit.,uallen@example.org
2001-02-16 19:59:33,hufftina,schmitthenry@example.net,Economic five difference identify instead us third.,draketammy@example.org
2001-02-16 10:54:11,charles41,gregorypacheco@example.com,Include new none or defense day.,ericawood@example.net
2001-02-16 07:34:56,martintodd,riveradaniel@example.net,View there ground also there.,angelataylor@example.com
2001-02-08 14:13:43,sheppardmichaela,dbarr@example.org,Allow story near military paper dog indeed mouth.,anthonyedwards@example.org
2001-02-12 16:39:03,gibbspaula,robertcrosby@example.net,Cut in film year senior get author.,jcrawford@example.org
2001-02-18 22:03:33,thompsonamy,lawrence28@example.com,Show seven here occur hand.,heather53@example.org
2001-02-16 03:25:50,brandimartin,ramireztracy@example.net,Mean wear explain radio.,ashleywilliams@example.net
2001-02-05 17:22:53,robert26,debra78@example.net,Individual fall degree sport bill modern for.,christianspencer@example.net
2001-02-18 14:51:07,fieldsjames,angelataylor@example.com,Do though school science prove give.,jessemurillo@example.net
2001-02-06 04:40:35,scottrick,harryromero@example.com,Our write effort cell them.,ebates@example.net
2001-02-09 11:31:14,darren55,xhart@example.com,Article technology open language seek marriage deep.,ytrevino@example.com
2001-02-08 12:31:32,xsaunders,justin73@example.com,Decision minute sign already.,schoi@example.com
2001-02-15 23:47:45,herbert60,samuelaustin@example.com,Campaign real popular important here save.,wilsonvalerie@example.com
2001-02-18 12:24:24,freemanjames,brianbrady@example.org,Record others scientist tell task white campaign.,andrea11@example.com
2001-02-11 10:30:54,williamsonmark,pnorton@example.com,Left purpose TV ask education you firm.,gperry@example.net
2001-02-15 07:13:01,ajohnson,myu@example.com,Growth big within.,sarah24@example.com
2001-02-07 06:35:25,jennifer82,ashleyriley@example.net,Move fall choice as summer business mind talk.,jennifer27@example.net
2001-02-16 04:01:49,sferguson,jasonfuller@example.com,Onto deal country here read want.,athompson@example.com
2001-02-08 01:47:51,sscott,gutierrezsean@example.org,Best oil authority box.,zrosales@example.org
2001-02-05 23:11:29,harrisstephanie,caseyknight@example.org,Near phone store now husband church green.,joneszachary@example.com
2001-02-17 22:02:17,brian27,michael42@example.net,Could around cultural put.,dhubbard@example.net
2001-02-13 21:21:32,brooke45,lmitchell@example.com,Throughout night forward part often population sound style.,hermandeborah@example.com
2001-02-17 10:37:34,mark75,amedina@example.net,Ask character effect discover professional.,spencerwalls@example.net
2001-02-16 05:35:32,garcialisa,stoutjoe@example.net,Huge current money city attention western.,hannahmelton@example.net
2001-02-05 06:51:24,hancockanita,haynesjeffrey@example.org,Body picture source authority simply.,juan60@example.net
2001-02-05 18:21:58,xhamilton,alejandro44@example.net,Manager option perhaps term loss.,pennynguyen@example.com
2001-02-08 18:17:23,evelasquez,zsmith@example.org,Reduce only person argue foreign.,gclarke@example.net
2001-02-05 09:18:26,jonathanbarton,donnadelacruz@example.org,Foreign both city.,hallrobin@example.org
2001-02-13 09:18:50,ashleycrosby,mpatterson@example.net,Experience perform eight any education half wide.,kathleenmalone@example.com
2001-02-08 21:55:57,howardjonathan,brian80@example.org,Hard black economy.,rodriguezkevin@example.com
2001-02-11 21:56:51,jsmith,lirobert@example.com,Reflect him fear everyone statement dinner.,sabrinacannon@example.org
2001-02-13 13:54:59,johnmclean,cdavid@example.com,Very along product eat represent program not.,tannerlori@example.org
2001-02-09 05:42:25,eherring,richard15@example.net,Then thank little.,abigailschultz@example.net
2001-02-10 21:24:50,bryantrichard,jrodriguez@example.com,Adult help green chance some.,michaelmitchell@example.org
2001-02-06 18:17:12,carlmartin,michaelthomas@example.net,Forget speak light act hundred food.,shellysilva@example.org
2001-02-10 21:01:50,kimleslie,rodriguezlarry@example.com,Usually three event who.,pfoley@example.org
2001-02-10 09:58:37,william18,hvilla@example.org,Available become value end natural.,chelseavelazquez@example.org
2001-02-11 00:34:03,kellykemp,schneidernicholas@example.com,Section side look.,bakermaria@example.net
2001-02-10 21:08:47,mccormickshannon,fowlerlauren@example.org,Full east rock.,wperez@example.net
2001-02-16 14:05:24,allisoncook,qmorris@example.org,She page nice phone report.,whiteangela@example.net
2001-02-05 09:18:26,garyjackson,cruzdeanna@example.org,Less final feeling force travel offer.,gary63@example.org
2001-02-12 21:43:26,kgardner,michellepalmer@example.net,Hit throughout remain stock support a work.,ywilkins@example.net
2001-02-10 08:18:59,amandawilson,pburke@example.org,Large politics major over organization matter learn.,williamsdennis@example.org
2001-02-18 05:51:18,jennifer65,joseph24@example.net,Good truth behind.,along@example.net
2001-02-10 18:31:43,jasonponce,rebecca14@example.net,Official dog edge fund important instead relate.,caitlingreen@example.com
2001-02-13 12:30:31,kbrooks,kendra56@example.net,Discuss case today all.,jacksonmichelle@example.com
2001-02-11 23:10:16,angela41,cheryl31@example.net,Range involve or show.,anthonyday@example.net
2001-02-17 04:09:56,alexander99,crystalthomas@example.com,East usually life blood before college.,saunderssharon@example.net
2001-02-07 02:30:54,ryanhart,eileenbarnes@example.com,Interesting yourself how close rise treatment owner behavior.,cunninghamrichard@example.org
2001-02-12 20:15:16,thompsonjorge,reidjoseph@example.com,Agency still gun unit rich risk.,richardangela@example.com
2001-02-09 05:27:28,gcarter,monica51@example.com,Behind institution admit rather audience arm.,toddhicks@example.com
2001-02-12 11:09:53,iellis,dmiller@example.net,Own former age discover career.,jaimeblair@example.org
2001-02-13 22:20:12,tsmith,csanchez@example.org,Into so person age everything college.,tammy61@example.org
2001-02-17 23:54:32,tsmith,csanchez@example.org,Piece station eat listen total center military.,lawrence28@example.com
2001-02-07 03:55:34,xgardner,brownann@example.org,During yard under something resource.,zacharyhumphrey@example.org
2001-02-12 04:05:39,mark63,wsanchez@example.net,Along marriage result both although less first.,lisajohnson@example.org
2001-02-16 09:40:58,timothy25,dianawarner@example.com,Especially white four really significant.,zacharymyers@example.org
2001-02-17 15:09:42,mary44,wellskim@example.com,By popular community arm.,kerrchristy@example.net
2001-02-19 10:39:12,ernestfisher,xgomez@example.org,Firm enjoy necessary already.,davidharris@example.net
2001-02-14 14:50:24,christopher48,levipowell@example.org,Commercial sit ground study there election.,xmassey@example.com
2001-02-11 12:55:51,martintodd,riveradaniel@example.net,Hard up rock measure which no Democrat food.,jacobwhite@example.com
2001-02-14 09:12:46,denise43,johnsonwilliam@example.net,Lot left space dog personal.,uharris@example.net
2001-02-15 21:07:19,xsmith,michaelguerra@example.net,She down yard figure lot son writer.,fisheranthony@example.com
2001-02-09 18:27:29,justin67,schneiderjessica@example.org,Start set bill trade successful again analysis around.,matthewboyd@example.net
2001-02-14 06:16:37,vpayne,aprilhanson@example.net,But street why order reason together.,angelacole@example.net
2001-02-18 02:33:28,gilbertray,tvargas@example.net,Little draw society choice result family argue.,caitlinbryant@example.net
2001-02-15 23:29:15,denise78,matthewcline@example.com,Whether four small simply hold never difficult.,hilljulia@example.org
2001-02-06 15:10:26,dianewood,tclark@example.net,Window age response information.,vvalencia@example.org
2001-02-11 03:26:19,xbailey,hicksjamie@example.com,Want skill explain report.,jorgethomas@example.org
2001-02-09 22:44:01,rchavez,lpalmer@example.net,Lay open also pay room happen.,stoutjoe@example.net
2001-02-16 06:52:49,parkermaria,tayloramanda@example.org,Owner full part sport friend apply oil.,rbowen@example.com
2001-02-13 18:12:02,manueltorres,brownkathryn@example.net,Professional energy lose receive into can discuss.,felicia45@example.com
2001-02-05 03:16:38,moniqueporter,choierin@example.net,Old window population skill list dinner.,bradley66@example.org
2001-02-18 20:39:51,margaretwalker,natashaparsons@example.com,Sign goal many.,khall@example.net
2001-02-07 11:00:25,heatherparker,padillajoshua@example.net,Political financial against Mr president court occur.,brian83@example.org
2001-02-13 02:11:49,nicole10,candice67@example.net,Now enjoy season myself.,devin73@example.net
2001-02-13 13:00:47,mirandajackson,berryscott@example.net,Remember quickly deep begin today good call.,scottsellers@example.com
2001-02-08 15:58:35,drichards,kelly11@example.org,Mind throw issue her.,ritaharper@example.org
2001-02-09 07:57:28,jack54,gregoryclark@example.org,Mouth hear everybody traditional piece accept.,nthompson@example.org
2001-02-19 05:29:32,crystal20,angelachambers@example.org,If teach reveal billion.,lgarcia@example.org
2001-02-17 05:18:46,kylebrewer,carolgonzalez@example.com,Threat black various education.,diane86@example.com
2001-02-17 01:46:33,edwin25,hermandeborah@example.com,Thus thank class indeed sea food million.,along@example.net
2001-02-15 16:31:21,mark37,atkinsonveronica@example.org,Amount performance collection four speak think hotel.,juliawilliams@example.com
2001-02-08 20:45:33,munozkeith,joneszachary@example.com,Money compare everything although real western.,cjackson@example.net
2001-02-09 03:27:57,pollardpriscilla,catherinejohnson@example.net,Deep important herself foot.,elizabethwilliams@example.com
2001-02-14 04:02:33,diazlisa,sanchezshelly@example.com,Travel bag charge sense answer.,kevinbishop@example.com
2001-02-14 00:57:55,chavezjasmine,sarahmcmahon@example.com,Agent measure where live.,zhall@example.com
2001-02-06 00:36:12,plee,scottmedina@example.com,Answer either light world.,odonnellmichael@example.com
2001-02-09 02:33:32,jonescharles,wkim@example.com,Back whom time husband center discover attorney.,zacharyclark@example.com
2001-02-05 19:33:21,riveravanessa,matthew30@example.com,Development voice doctor be car office.,dennis84@example.net
2001-02-07 15:59:21,jack62,wendy21@example.com,Once movement hard cold available author.,michellejenkins@example.net
2001-02-05 10:30:25,brandybrowning,uwhite@example.net,Event notice someone moment still family himself often.,kevinbishop@example.com
2001-02-16 16:37:58,harrisdebbie,katherine02@example.net,Discover hotel seven drive nothing.,amyjimenez@example.com
2001-02-14 03:13:40,dianeherring,alexanderlopez@example.com,Face top memory final listen require but.,andersonteresa@example.com
2001-02-18 21:50:38,jacquelinedodson,matthewboyd@example.net,American day consumer loss turn significant successful.,fisheranthony@example.com
2001-02-13 02:45:53,bthomas,kathryn36@example.com,Week beautiful word plant weight.,jmiller@example.net
2001-02-05 18:37:26,tsanchez,logan52@example.com,State stand experience military tend.,thomasdavis@example.com
2001-02-18 22:19:53,uvazquez,jeffmoore@example.org,Speak method ready product.,wilsonmary@example.net
2001-02-05 14:02:38,ashleywhite,kingjennifer@example.net,Paper think share everyone concern clear.,zwillis@example.org
2001-02-17 19:45:19,garyerickson,ronniebauer@example.net,Never court gas third thing compare.,jeffmoore@example.org
2001-02-15 10:36:31,wolfecarolyn,hilljulia@example.org,Now their according red feel win serious.,millerrhonda@example.com
2001-02-17 03:55:37,johnmonroe,ericperez@example.com,Morning direction owner up.,shanna@example.net
2001-02-15 17:53:54,gouldjennifer,brandy59@example.net,Add picture customer recently.,patricknelson@example.com
2001-02-06 03:20:50,robinsondeanna,amanda98@example.com,Race pass media nothing.,mmiller@example.com
2001-02-16 17:58:18,ijackson,richard70@example.net,Environment stuff Congress young oil yeah ask.,vgomez@example.net
2001-02-17 09:07:40,sue99,kirbyerica@example.com,My increase fall together born.,matthewmccoy@example.net
2001-02-14 22:42:54,william65,brandon15@example.com,Green kid discover authority.,anthonylove@example.com
2001-02-11 22:10:21,horngary,matthew29@example.com,Pick firm act hair star material professor.,david11@example.net
2001-02-08 20:25:06,shane98,xrogers@example.org,Fill deal manager family loss catch Congress.,katherine02@example.net
2001-02-19 01:40:06,jennifer80,ahensley@example.com,Task forward just green time.,padillajoshua@example.net
2001-02-07 21:43:10,josephmartinez,tuckermelanie@example.com,Total expect community training.,vegadawn@example.com
2001-02-14 08:53:01,gbird,lisasanchez@example.net,Month even trouble morning put.,tbrown@example.org
2001-02-19 06:20:01,diazmelissa,christinetorres@example.org,Receive lead both rate wide sister.,campbellmary@example.org
2001-02-18 20:51:06,xjackson,cindy40@example.org,Visit official tree present base.,oharris@example.org
2001-02-09 18:27:29,bennettkimberly,alexanderedwards@example.org,Federal end pull report generation decision.,rwatson@example.com
2001-02-07 15:53:48,leonardsmith,melaniedaugherty@example.org,Prove western miss example father sell.,hvasquez@example.net
2001-02-09 02:47:42,ithompson,cmichael@example.org,Ahead travel indicate quickly key head.,lindashaw@example.org
2001-02-15 23:26:19,paulnathan,rwatson@example.com,Bad smile within positive still.,keith28@example.net
2001-02-05 13:40:43,ryan04,phillipsjoshua@example.com,Conference help heart participant most radio seven.,nicolas47@example.org
2001-02-18 14:05:52,michael77,raven81@example.org,Important candidate item number response imagine.,jermainejohnson@example.net
2001-02-07 20:51:19,sarah54,christopherhernandez@example.org,Staff establish form this Congress.,vanessalawrence@example.com
2001-02-19 04:51:26,crystal02,christina18@example.com,Fear wonder each food up.,dhurst@example.net
2001-02-11 09:37:53,herreralauren,justinjones@example.org,Chance sort physical by get effect make.,mccormickbarbara@example.net
2001-02-16 06:20:08,janet40,mclaughlinshannon@example.net,Expert when least street entire newspaper some.,brittanyford@example.com
2001-02-14 11:50:10,elizabeth25,william70@example.org,Word avoid source become free people.,tracy47@example.net
2001-02-08 17:34:24,nsalinas,melissawong@example.net,Air hundred spring offer beyond.,randalldavis@example.org
2001-02-10 00:16:23,fvincent,torrescesar@example.com,Eight speak city seem generation perhaps.,jasmine98@example.net
2001-02-06 01:06:44,kburton,xbrown@example.com,Event yet tonight green open less.,michaelmalone@example.com
2001-02-10 00:36:19,michellewalls,wallacemiguel@example.com,Around field thing.,nicoledecker@example.net
2001-02-10 00:32:46,mmartin,wilkinsonapril@example.net,House artist subject kitchen personal.,kelly11@example.org
2001-02-08 22:35:02,gbird,lisasanchez@example.net,Onto hotel figure I across.,lori88@example.net
2001-02-05 15:59:38,carolinejackson,annjohnson@example.org,Often few across than direction performance father.,natashaparsons@example.com
2001-02-06 11:40:48,paulnathan,rwatson@example.com,Tell will office family article free energy series.,sbell@example.org
2001-02-07 12:55:55,khandarren,jacobponce@example.net,Upon huge store college threat history house.,brownnicole@example.org
2001-02-16 18:51:58,barkerrobert,sandrawagner@example.net,Word sign situation others side.,dguzman@example.com
2001-02-05 03:03:56,carteranna,usavage@example.net,Trial popular dream.,tammy61@example.org
2001-02-16 19:21:08,wolfecarolyn,hilljulia@example.org,Fast factor authority past commercial too approach chair.,pmclean@example.org
2001-02-11 08:46:51,pameladyer,fsmith@example.net,Stage consider doctor two when.,xhart@example.com
2001-02-14 04:23:03,lopezdavid,michellethomas@example.com,Real behind simply success win trial.,stephaniewood@example.net
2001-02-07 14:42:31,judy80,santanadaniel@example.com,Tv edge hard carry.,ianmoyer@example.com
2001-02-14 02:26:13,beckbrent,michaelparks@example.net,Analysis question though.,jmiller@example.net
2001-02-12 06:13:06,aball,katelyndavis@example.net,Charge feel land key somebody note least.,camachoashley@example.org
2001-02-10 20:08:25,harrisonshawn,tracy47@example.net,Process behind suffer spend.,anthonyday@example.net
2001-02-13 20:48:03,sandrawilliams,ashleymorales@example.net,Way within strategy certain scene tonight try.,elizabeth53@example.com
2001-02-11 12:18:33,qbradley,jennifer81@example.org,Material be beyond those.,vgutierrez@example.net
2001-02-07 15:31:42,jenniferneal,boltonrebecca@example.org,Policy early indicate able quite.,uwells@example.com
2001-02-15 17:21:56,benjamin79,jessicabrennan@example.net,Machine never task anyone.,sabrinacannon@example.org
2001-02-16 02:22:56,pamela35,jgonzalez@example.net,National amount us value life must specific.,stephenwhitney@example.net
2001-02-11 06:08:13,fordmichelle,patrickcalhoun@example.org,Notice try tell current else million.,herbert85@example.org
2001-02-09 18:04:37,emily84,juliawilliams@example.com,Usually heavy much main Republican crime.,douglasbishop@example.com
2001-02-12 21:36:22,staylor,michaelmitchell@example.org,Make speak risk rock.,martinezkevin@example.net
2001-02-14 10:50:53,angelaphillips,elewis@example.org,Fire deep thousand glass how hotel.,kaylahicks@example.net
2001-02-14 03:32:26,wolfecarolyn,hilljulia@example.org,Change picture guess deep.,swilson@example.com
2001-02-17 05:26:07,donovanmarissa,john03@example.com,Agency real later interview.,daniel85@example.org
2001-02-11 18:11:43,twalker,lisareynolds@example.com,Final college run price against.,xrogers@example.org
2001-02-11 08:08:48,vanessa56,christinabates@example.com,Call then this blue heavy property.,sarazimmerman@example.net
2001-02-15 08:48:22,robin09,rebeccagreen@example.net,Common herself important six.,caitlinbryant@example.net
2001-02-08 07:58:42,kathleen94,briannajohnston@example.org,Fill tax child course seat no interest.,rwhite@example.com
2001-02-06 19:33:27,vgonzalez,jeremysalazar@example.net,Leg involve look ability understand.,hallmarcus@example.org
2001-02-12 02:36:28,jonesangela,robert79@example.com,Threat kid newspaper space important.,riveradaniel@example.net
2001-02-17 21:25:05,drobinson,rosechan@example.org,Learn it hard language rise president executive.,phillipsjoshua@example.com
2001-02-08 21:23:27,jvilla,amanda54@example.org,Treatment difference political finish girl budget blood.,jacksonlindsay@example.org
2001-02-16 19:03:09,johnsonstephanie,valeriejohns@example.net,We operation fly should hard page important all.,clarkerin@example.com
2001-02-17 08:09:07,sroberts,robin08@example.net,Wait food should.,youngbrittney@example.com
2001-02-07 17:25:07,carlmartin,michaelthomas@example.net,Anyone thing school first benefit happen unit assume.,jacksonbrandi@example.org
2001-02-10 00:53:53,wolfecarolyn,hilljulia@example.org,Stop environmental two return.,johnsonrobert@example.com
2001-02-15 23:04:33,peckmichael,frogers@example.org,Specific detail mean history.,sheilagreen@example.com
2001-02-09 03:23:01,vanessa56,christinabates@example.com,Investment study stop family.,wallacelaura@example.org
2001-02-18 13:09:49,karen27,michael71@example.net,Among his information if act natural.,gclarke@example.net
2001-02-17 23:39:42,kevin14,schoi@example.com,Official fire participant style walk history.,justin36@example.org
2001-02-07 01:09:04,angela41,cheryl31@example.net,Type others shoulder talk themselves.,hallroy@example.com
2001-02-18 23:09:17,martinezstephen,michaelrojas@example.net,Medical race attention customer live several yard act.,santiagojoshua@example.net
2001-02-17 13:02:46,smcgee,kmartinez@example.org,Everyone management station.,mbrock@example.org
2001-02-08 03:02:30,scottspencer,dguzman@example.com,West prepare knowledge their and east drop follow.,kirbyerica@example.com
2001-02-12 11:35:14,sandersandrew,randall16@example.net,Behind know hope in several high onto husband.,scottsellers@example.com
2001-02-15 16:08:28,matthewgraham,samanthaharris@example.net,Common administration actually question lose society report.,christopher18@example.org
2001-02-09 14:23:33,robertowatson,allisonparsons@example.org,Wait standard form ask.,lbarron@example.net
2001-02-12 21:14:46,bennettnicholas,stephen75@example.org,Team challenge role take.,felicia45@example.com
2001-02-13 03:31:20,timothynovak,barry13@example.net,Understand beautiful alone politics series.,stephanie52@example.com
2001-02-14 21:20:27,velezpatricia,cameron14@example.org,Or become style.,michaelguerra@example.net
2001-02-13 04:11:03,philipwilliams,martinezkevin@example.net,Drop reason imagine later red.,regina40@example.org
2001-02-06 01:11:12,jbrown,millerrhonda@example.com,Trial early form concern right commercial.,levipowell@example.org
2001-02-06 12:42:34,emily01,raymond27@example.com,Simple agency mother wall must our thank.,carterrobert@example.com
2001-02-12 20:36:20,amandawilson,pburke@example.org,Just bar occur because couple.,victoria39@example.org
2001-02-10 16:29:34,patriciaharris,jasmin20@example.org,Husband something coach road doctor number.,ericawood@example.net
2001-02-06 01:15:36,huntercraig,bowendonald@example.org,Act page style treat condition.,clarkedavid@example.org
2001-02-08 19:57:24,xjackson,cindy40@example.org,Despite bank itself make task within.,oholmes@example.org
2001-02-08 08:12:38,brittanyglenn,schwartzpaul@example.com,Father draw run exactly.,angelataylor@example.com
2001-02-15 20:27:16,davidstark,barneselizabeth@example.org,American note old daughter different.,brittanyford@example.com
2001-02-10 10:56:27,barkerrobert,sandrawagner@example.net,Significant local debate since grow morning strategy four.,jennifer56@example.com
2001-02-14 02:44:45,anthonyjeremy,nrodgers@example.org,Local world per different.,kevin60@example.org
2001-02-11 16:19:14,spatel,alexaallen@example.net,Explain fund matter structure.,peter18@example.net
2001-02-06 05:37:53,mvasquez,louis74@example.org,Well almost anyone.,eric78@example.org
2001-02-12 01:22:30,uthornton,mvasquez@example.com,Bill language third region fall ever front.,raven81@example.org
2001-02-07 12:21:37,timothydavis,along@example.net,Eat live another perhaps professor bad ok amount.,eric77@example.net
2001-02-06 00:39:37,tonyabowers,bryantlogan@example.org,Claim top attorney outside.,michaelparks@example.net
2001-02-18 05:54:27,villaashley,juan60@example.net,Reduce skin possible voice fly game.,matthewboyd@example.net
2001-02-12 09:48:01,leelindsay,vmooney@example.com,Design federal partner campaign everybody book.,briannalawrence@example.org
2001-02-13 16:20:58,kathrynyang,brenda58@example.org,Feel perhaps according security.,clarkedavid@example.org
2001-02-07 11:18:02,jowens,stephenhernandez@example.org,Need practice recent candidate decide safe.,jonathan68@example.net
2001-02-15 02:41:00,robynbates,sierra00@example.com,Air everyone want.,kevinbishop@example.com
2001-02-11 00:34:03,qbradley,jennifer81@example.org,Baby large avoid answer near service wide.,shelly67@example.org
2001-02-16 11:24:14,john07,abigailschultz@example.net,Guy fire he seven government.,tinaelliott@example.org
2001-02-09 15:41:05,iperkins,rbowen@example.com,Collection course national box picture act.,eugene48@example.net
2001-02-08 10:54:12,edwin25,hermandeborah@example.com,Movie think rest book add despite.,lunajacqueline@example.com
2001-02-06 21:11:28,jonathaningram,bryan22@example.com,Eight right out though remain bit read.,uwilson@example.org
2001-02-09 06:46:30,carrollpeter,robertlee@example.org,Loss military nice while.,linda67@example.com
2001-02-06 13:28:11,wwilson,pfleming@example.org,Land piece mission seven cold.,morrisonjacob@example.com
2001-02-16 18:00:21,robinsoncraig,mary40@example.com,Cold civil quite fight who manager son.,samanthaharris@example.net
2001-02-15 18:33:08,andrewwilkerson,fergusonpam@example.org,Pay nice laugh first.,sierra00@example.com
2001-02-19 12:07:21,qdaugherty,watkinsgary@example.org,Fire account until avoid candidate.,alexanderrobert@example.com
2001-02-16 00:59:09,lindsey53,hkennedy@example.net,Although bar step Mrs subject take find necessary.,bgarcia@example.org
2001-02-10 23:31:34,debrablack,michaelwashington@example.net,Pretty bit situation son second court newspaper.,brian80@example.org
